precio;localidad;tamanio;habitaciones;descripcion;link;descripcion_larga;distrito
330.000;Piso en Calle del Canal del Bósforo 56;81;3;Planta 2ª exterior con ascensor;/inmueble/104432027/;"
Ehabitar vende piso de 3 dormitorios en Canillejas. Madrid.
INMOBILIARIA CON LLAVES. SIN COMISIONES DE AGENCIA.
Piso en segunda planta con ascensor. Con una superficie catastral de 81 m2. , construidos. Se distribuye en hall de entrada, salón-comedor, tres dormitorios, cocina y un baño. Si se desea, en la reforma se
";san-blas
172.000;Piso en Avenida Séptima Rejas;42;1;Bajo exterior con ascensor;/inmueble/106647984/;"
Tecnocasa Agencia inmobiliaria de MADRID - zona CIUDAD PEGASO - ALAMEDA DE OSUNA - REJAS - Oficina Tecnocasa de MADRID
Vende apartamento situado en Avenida Séptima; (Metro El Capricho línea 5)
SE VENDE CON INQUILINO HASTA EL JULIO DE 2026, ALQUILADO EN 600€ AL MES.
PLANTA BAJA CON PUERTA DIRECTA A CALLE
38 m2
Sal
";san-blas
1.350.000;Chalet pareado en Calle Alegría de Oria Salvador;239;4;;/inmueble/108248266/;"
**Chalet Pareado en El Salvador, Madrid - Tu nuevo hogar te espera**
Descubre este encantador chalet pareado en El Salvador, Madrid, construido en 1996 y con una superficie total de 239 m². Este hogar se distribuye en tres plantas más un sótano, ofreciendo un amplio espacio para disfrutar en familia. La planta baja cu
";san-blas
289.999;Piso en Avenida Quinta Rejas;89;3;Planta 3ª exterior con ascensor;/inmueble/109245078/;"
Tecnocasa Agencia inmobiliaria de MADRID - zona CIUDAD PEGASO - ALAMEDA DE OSUNA - REJAS - Oficina Tecnocasa de MADRID
Vende piso situado en Avenida Quinta (Ciudad Pegaso);
3ª PLANTA CON ASCENSOR
89 m2 construidos.
3 dormitorios, salón, cocina y 2 baños.
Sol de mañana y mediodía. Tiene vista despejada hacia zona a
";san-blas
489.000;Piso en Calle de Suecia Rosas;168;3;Planta 1ª exterior con ascensor;/inmueble/109101674/;"
ZARBAY CONSULTING PRESENTA: Luminoso piso de 3 dormitorios en Las Rosas (Madrid), con garaje y trastero
Se vende vivienda situada en un entorno residencial muy tranquilo, rodeado de zonas verdes, en la zona de Las Rosas (Madrid). Ubicada en un primer piso alto de un edificio de finales de los años 90, la vivienda se e
";san-blas
164.700;Piso en CL Brocado 8;57;2;Planta 3ª exterior sin ascensor;/inmueble/109122803/;"
*** INMOBILIARIA CON LLAVES Y SIN COMISIONES ***
EHABITAR VENDE PISO de 54 m² ubicado en Madrid. Se trata de un piso de 54 m² distribuidos en salón-comedor, cocina, 2 dormitorios y 1 baño.
El piso se sitúa en el barrio de Amposta, dentro del distrito de San Blas-Canillejas, una zona residencial consolidada en el est
";san-blas
1.220.000;Ático en Calle del Doctor Zamenhof Salvador;160;3;Planta 5ª exterior con ascensor;/inmueble/107785027/;"
Espectacular ático con terraza de 160 m2 recién construida en urbanización de lujo al lado del Parque Quinta de los Molinos y la Clínica Universidad de Navarra (CUN), en la quinta y última planta de un elegante y moderno edificio nuevo de 2024, construido con las máximas calidades y acabados.
Se trata de un ático sup
";san-blas
238.500;Piso en Calle de los Lenceros Amposta;58;4;Planta 1ª exterior sin ascensor;/inmueble/106167621/;"
Renta Mensual de 2.370€
INMUEBLE PARA INVERSORES: Rentabilidad anual entre 12 y 13%
Contamos con inmuebles TOTALMENTE REFORMADOS y con rentas inmediatas del 13% anual Netas (libre de gastos). Si así lo desean, nosotros nos encargamos de la administración del piso y de todo lo que el propietario necesite.
Valor Compr
";san-blas
373.000;Piso en Calle de Diana Canillejas;75;3;Planta 2ª exterior sin ascensor;/inmueble/107811106/;"
SE VENDE precioso piso exterior, muy luminoso y alegre con estupenda terraza.
Situado en la segunda planta de un edificio sin ascensor (altura de primero) pero con una escalera muy cómoda; se distribuye en 3 dormitorios, baño con ducha y aseo, salón con cocina totalmente equipada con electrodomésticos, acceso directo a
";san-blas
226.000;Piso en Amposta Madrid;57;3;Planta 2ª exterior sin ascensor;/inmueble/108388860/;"
""ESTUPENDA VIVIENDA EN VENTA
Excelente vivienda de tres dormitorios y un baño. Se encuentra en la 2ª planta de un edificio residencial. No dispone de ascensor. Situado en AMPOSTA en el distrito de San Blas.
La vivienda se distribuye en tres dormitorios, salón-comedor, cocina americana y un baño. Cuenta con cocina amu
";san-blas
275.000;Piso en Canillejas Madrid;50;2;Planta 2ª exterior con ascensor;/inmueble/108389253/;"
""ESTUPENDA VIVIENDA EN VENTA
Excelente vivienda de dos dormitorios y un baño. Se encuentra en la 2ª planta de un edificio residencial. Dispone de ascensor. Situado en CANILLEJAS en el distrito de San Blas.
La vivienda se distribuye en dos dormitorios, armarios empotrados, salón-comedor con acceso a terraza, cocina in
";san-blas
448.000;Piso en Simancas Madrid;106;2;Planta 1ª exterior con ascensor;/inmueble/108025170/;"
Con Testa Homes no pagas comisión ni honorarios de intermediación por tu inmueble.
Oportunidad de inversión: inmueble en rentabilidad. Viviendas actualmente alquiladas. Consulte con nuestro Agente Comercial la información adicional sobre el inmueble y las condiciones especiales de compraventa.
*No se admiten visitas a
";san-blas
198.000;Piso en Simancas Madrid;47;2;Planta 1ª exterior con ascensor;/inmueble/108850018/;"
""ESTUPENDA VIVIENDA EN VENTA
Excelente vivienda de dos dormitorios y un baño. Se encuentra en la planta 1 de un edificio residencial. Dispone de ascensor. Situado en Simancas en el distrito de San Blas.
La vivienda se distribuye en dos dormitorios, salón-comedor, cocina independiente y un baño. Cuenta con cocina am
";san-blas
325.000;Piso en Calle de Cronos Simancas;76;1;Planta 1ª exterior con ascensor;/inmueble/108280936/;"
Loft compuesto de planta baja y alta, ambas muy luminosas, Amplio salón con cocina americana y aseo, con una superficie construida de 47 m2. Se accede a la planta superior por una escalera abierta en un lateral, dormitorio con baño completo con una superficie construida de 22 m2.
Cristaleras con persianas de foscurit e
";san-blas
415.000;Ático en Calle del Río Matarraña Salvador;65;1;Planta 4ª exterior con ascensor;/inmueble/108849524/;"
Ático exclusivo con dos terrazas privativas de 40 m2 y 8 m2. Cuenta con buenas calidades y se encuentra en una zona muy bien comunicada y con todo tipo de servicios. La vivienda tiene una superficie construida de 63 m2 sin contar las terrazas.
Está distribuida en 1 dormitorio doble con un amplio armario-vestidor de cua
";san-blas
451.000;Piso en Canillejas Madrid;104;2;Planta 1ª exterior con ascensor;/inmueble/108617873/;"
""ESTUPENDA VIVIENDA EN VENTA
Excelente vivienda de dos dormitorios y dos baños. Se encuentra en la 1ª planta de un edificio residencial. y cuenta con trastero. Dispone de ascensor. Situado en Canillejas en el distrito de San Blas.
La vivienda se distribuye en dos dormitorios, armarios empotrados, salón-comedor con ac
";san-blas
636.000;Ático en Suecia Rosas;116;1;Planta 7ª exterior con ascensor;/inmueble/109227942/;"
Espectacular ático REFORMADO ubicado en el exclusivo conjunto residencial: ""Mirador de Suecia"". , ideal para parejas!
Sus 73 m2 se distribuyen armoniosamente en 1 dormitorio, cocina independiente cuarto de baño, salón y una espectacular terraza de 43 m2 que dispone de una zona cubierta que garantiza su disfrute sin i
";san-blas
349.990;Piso en Rosas Madrid;53;1;Planta 7ª exterior con ascensor;/inmueble/109216022/;"
INMOVELILLA vende en exclusiva esta fantástica vivienda en un edificio bastante singular, situada en una urbanización privada en Las Rosas, uno de los barrios con mayor proyección de Madrid.
Vivienda de 1 dormitorio con armario empotrado, salón-cocina independiente con salida a terraza ideal para disfrutar al aire lib
";san-blas
93.500;Piso en CL Tejedores Amposta;56;2;Planta 2ª exterior sin ascensor;/inmueble/108537249/;"
Oportunidad inmueble sin posesión, no se puede visitar. Propio para inversores o vecinos que conozcan el inmueble.
Disponemos de una amplia cartera de inmuebles sin posesión en madrid y en toda españa.
Propio, pequeño y gran inversor.
Madrid es un municipio y una ciudad de españa. La localidad, con categoría histórica
";san-blas
495.000;Ático en Calle de San Rosendo Canillejas;105;3;Planta 4ª exterior con ascensor;/inmueble/107682525/;"
¡Descubre tu nuevo hogar en el corazón de Canillejas!
CONYCOR te presenta este exclusivo ático dúplex en la tranquila calle de San Rosendo, un oasis de paz en el vibrante distrito de San Blas.
Imagina vivir rodeado de parques y jardines, con excelentes comunicaciones que te conectan rápidamente con el centro de la ca
";san-blas
438.000;Piso en Calle de Pobladura del Valle Amposta;117;3;Planta 1ª exterior con ascensor;/inmueble/108042256/;"
Vivienda Madrid ofrece en exclusiva amplio piso exterior de 107 metros cuadrados útiles, para entrar a vivir. Está compuesto por un amplio y luminoso salón, con acceso directo a una espaciosa terraza de 15m2, cocina totalmente equipada, con acceso también a su practica terraza, dos baños, uno de ellos en suite, tres do
";san-blas
185.000;Piso en metro san blas Amposta;58;2;Planta 1ª exterior sin ascensor;/inmueble/109002613/;"
¡Descubre tu nuevo hogar en este piso exterior de 55 metros cuadrados! Con una distribución práctica que incluye un acogedor salón, una cocina funcional, un baño completo y dos cómodos dormitorios, este espacio es ideal para disfrutar de la vida urbana sin renunciar a la comodidad. Los suelos de tarima y puertas de mad
";san-blas
1.150.000;Piso en Simancas Madrid;401;3;Planta 5ª exterior con ascensor;/inmueble/103312602/;"
Propiedad realmente única: un auténtico loft ático con enorme terraza donde la luz es la gran protagonista al ocupar la esquina de un moderno edificio y disfrutar de las dos mejores orientaciones: Este y Sur. Sus grandes ventanales inundan de luz todos los espacios y le confieren una atmósfera alegre y moderna.
Al tra
";san-blas
142.000;Piso en Calle Muelas del Pan 4;52;2;Planta 3ª exterior sin ascensor;/inmueble/108652073/;"
Actualmente, no es posible realizar visitas al interior del inmueble. Las fotografías pueden no reflejar el estado actual de la propiedad.
Fecha de fin de contrato: 09/2029
Renta actual: 314,57 € mensuales
Cómodo Piso en Madrid, ideal para parejas. Este práctico Piso dispone de una superficie de 52 m² construidos dis
";san-blas
1.200.000;Chalet en Calle de Toscana Arcos;512;5;;/inmueble/108624738/;"
Ubicado en la prestigiosa Calle de Toscana, en la vibrante ciudad de Madrid, este majestuoso chalet residencial se presenta como una joya arquitectónica que combina elegancia y confort. Con una orientación sur que garantiza una excelente luminosidad durante todo el día, esta propiedad se extiende sobre 512 m² construid
";san-blas
285.000;Piso en Calle de Jaime Hermida Simancas;55;2;Planta 3ª exterior sin ascensor;/inmueble/109202437/;"
VOhome propiedades Salvador/Julián Camarillo/Simancas vende en exclusiva:
Acogedor piso de 2 dormitorios situado muy cerca de la emblemática calle Alcalá.
El inmueble se encuentra en una tercera planta y se distribuye en hall distribuidor, salón comedor con acceso a terracita acristalada ideal para el relax, baño con
";san-blas
160.500;Piso en Calle de los Marineros s/n;54;3;Planta 1ª exterior sin ascensor;/inmueble/107887444/;"
¡Oportunidad de inversión! Piso en venta con inquilinos – Rentabilidad desde el primer día
Se vende piso con inquilinos en situación regularizada, ideal para inversores que buscan rentabilidad inmediata.
La vivienda cuenta con 3 habitaciones amplias, 1 baño completo, salón luminoso y cocina independiente.
El inmueble
";san-blas
220.000;Piso en Calle de Samaniego Rejas;46;1; con ascensor;/inmueble/107681327/;"
Excelente apartamento de un dormitorio y un baño. Se encuentra en la planta quinta de un edificio residencial de seis plantas sobre rasante. Dispone ascensor. Situado en el Madrid. La vivienda se distribuye en un dormitorio con armario empotrado, amplio salón-comedor, cocina y un baño. La superficie construida de la vi
";san-blas
695.000;Chalet adosado en Calle Tres Rejas;140;3;;/inmueble/109090800/;"
Magnífico chalet pareado de 3 habitaciones y 2 baños, en Rejas.
140 m2 construidos. Orientación Sur.
Jardín de 140 m2.
Armarios empotrados, suelo de parquet, ventanas climalit y puertas lacadas.
Cocina amueblada.
Calefacción con gas natural y aire acondicionado.
Dispone de trastero.
NO PIERDA ESTA OPORTUNIDAD Y
";san-blas
264.900;Piso en Arcos Madrid;94;3;Bajo exterior sin ascensor;/inmueble/108922415/;"
Your Home pone a disposición de sus clientes piso en exclusiva de 84 m², distribuido en 3 dormitorios, salón-comedor de 25 m² con salida a terraza, cocina espaciosa con comedor, amueblada con acceso a una segunda terraza y dispone de baño completo con bañera.
No espere más para visitarla es uno de los barrios que comp
";san-blas
422.000;Piso en Arcos Madrid;94;3;Planta 8ª exterior con ascensor;/inmueble/108316294/;"
'TECNOCASA 'ESTUDIO SAN BLAS 2018 S. L. ' Vende inmueble de 94 m2 construidos en la ZONA ARCOS de SAN BLAS.
Piso reformado a estrenar con acabados de lujo y tecnología de última generación.
Se vende espectacular vivienda totalmente reformada, con materiales de alta calidad y una distribución funcional que combina di
";san-blas
395.000;Piso en Calle de Arcos de Jalón Arcos;109;4;Planta 8ª exterior con ascensor;/inmueble/109102520/;"
Grupo Inmobiliario Miracasa vende vivienda en calle Arcos de Jalón: Piso en 8ª Planta exterior, muy luminoso. Compuesto de cocina con terraza, amplío salón independiente con acceso a otra terraza, 4 dormitorios con armarios empotrados, dispone de dos cuartos de baño, uno de ellos con bañera francesa y otro con un gran
";san-blas
580.000;Piso en Calle de Estocolmo Rosas;86;3;Planta 3ª exterior con ascensor;/inmueble/109077118/;"
-ZONA LAS ROSAS- Piso de 86m², exterior, amueblado y para entrar a vivir. La vivienda consta salón con acceso a terraza, tres dormitorios, dos cuartos de baño y cocina independiente, amueblada, equipada con electrodomésticos y terraza tendedero. Calefacción y agua caliente individual por Gas Natural. Aire acondicionado
";san-blas
299.900;Piso en Colonia Occidente 2;79;3;Planta 2ª exterior con ascensor;/inmueble/108226572/;"
Inmobiliaria Valeshouse presenta en exclusiva este fantástico piso en venta en una de las Mejores Zonas de Madrid!
Este piso se encuentra justo al lado del Centro Comercial Plenilunio,
ofreciendo una ubicación inmejorable ( Colonia Occidente).
Con 3 amplios y luminosos dormitorios, dos de ellos con armarios empotr
";san-blas
172.000;Piso en Calle Juguetería Amposta;50;2;Bajo exterior sin ascensor;/inmueble/107256633/;"
Bonita vivienda rodeada de parques infantiles, consta de dos habitaciones salón, cocina Wc y pequeño trastero dentro de la vivienda.
Puedes ver un vídeo de la vivienda dentro de esta página.
Se encuentra en buen estado y tiene cerca todos los servicios, transporte público, comercios, colegios etc.
Es un bajo pero n
";san-blas
299.000;Piso en Calle Longares 36;100;3;Bajo exterior sin ascensor;/inmueble/102771497/;"
Se VENDE amplia vivienda de 100m2, recién reformada.
Cocina completamente amueblada, con todos los electrodomésticos, baño completo con plato de ducha con mampara.
Bomba de calor frio marca Daikin recién instalada.
Tb consta de otro cuarto pequeño que puede tener varias funciones (despensa, cuarto de lavadora secadora
";san-blas
142.000;Piso en Calle del Fresno Arcos;52;1;Planta 1ª exterior sin ascensor;/inmueble/109214456/;"
“Esta propiedad se encuentra alquilada. No se puede visitar. No apta para compradores que requieran financiación hipotecaria. El comprador se subrogara al contrato de alquiler vigente y a las condiciones indicadas en el contrato de alquiler vigente.
“La información proporcionada referente a la distribución y estructur
";san-blas
169.000;Estudio en Calle Víctor González 6;Planta;45;;/inmueble/101665195/;"
ALTERNATIVA INMOBILIARIA CANILLEJAS Vende estudio en rentabilidad, actualmente alquilado.
Inquilino solvente y demostrable, el piso esta alquilado hasta el día 31 de enero de 2029.
Renta actual 519€/mes, actualizable con IPC cada año (Enero)
El inmueble es tipo estudio, con espacio diáfano, aire acondicionado con bomb
";san-blas
375.000;Piso en Calle de Nanclares de Oca Rejas;80;2;Planta 1ª exterior con ascensor;/inmueble/103678910/;"
¡Increíble oportunidad de adquirir un hermoso piso en la zona de Rejas!
Este inmueble reformado, cuenta con una ubicación privilegiada, cerca del parque Pinares y del Polígono de las Mercedes.
Con 80 m² construidos, se distribuye en una amplia entrada que te dará acceso a un salón independiente, perfecto para disfru
";san-blas
220.000;Piso en Calle de Samaniego Rejas;46;1;Planta 5ª exterior con ascensor;/inmueble/109244670/;"
Excelente apartamento de un dormitorio y un baño. Se encuentra en la planta quinta de un edificio residencial de seis plantas sobre rasante. Dispone ascensor. Situado en el Madrid. La vivienda se distribuye en un dormitorio con armario empotrado, amplio salón-comedor, cocina y un baño. La superficie construida de la vi
";san-blas
250.000;Piso en Calle de San Faustino Canillejas;74;3;Planta 2ª exterior sin ascensor;/inmueble/109192558/;"
TECNOCASA - Barrio de Canillejas VENDE Vivienda ubicada en la Calle San Faustino.
La vivienda cuenta con una reforma integral del año 2022 y se distribuye de la siguiente manera: Tres habitaciones amplias y luminosas, perfectas para el descanso y la privacidad de todos los miembros de la familia, un cuarto de baño com
";san-blas
320.000;Piso en Calle de Argenta 6;89;3;Planta 8ª exterior con ascensor;/inmueble/108062731/;"
Vivienda con 89 m² construidos, en 8ª planta. Todo exterior. Cuenta con tres habitaciones, con armarios empotrados. Salón comedor con salida a balcón con 2 armarios trasteros en el balcón con mucho espacio de almacenaje. Baño con ducha de hidromasaje. Cocina con acceso a un tendedero. Además, armario empotrado en el pa
";san-blas
210.000;Piso en Calle de Ribadesella Simancas;65;2;Planta 4ª exterior sin ascensor;/inmueble/108476911/;"
GPG-19182  Piso en Venta para Reformar – Zona García Noblejas
 Ubicación estratégica en el barrio de Ciudad Lineal, zona García Noblejas, rodeado de comercios y perfectamente conectado.
 Características del Inmueble:
2 dormitorios con buena distribución.
1 baño.
Salón amplio, ideal para rediseñar con un estilo m
";san-blas
415.000;Piso en Calle de Toscana Arcos;120;3;Planta 4ª exterior con ascensor;/inmueble/109074549/;"
VIVIENDA SUJETA AL PLAN 18.000
¡Esta es tu oportunidad! ¿Te imaginas cómo sería tu vida en esta vivienda?
Finca en una urbanización privada con zona infantil, zonas verdes y conserje.
PARA ENTRAR A VIVIR: Desde Capitalis Servicios Inmobiliarios te ofrecemos, en exclusiva, esta vivienda en el barrio de Arcos que gara
";san-blas
129.000;Piso en Calle de los Herbolarios Arcos;64;2;Planta 1ª exterior sin ascensor;/inmueble/107680792/;"
>>>>
Inmueble sin posesión y sin acceso al interior. Las fotografías del interior y las características del activo, pueden no ajustarse al estado actual.
NO COBRAMOS COMISIÓN DE INTERMEDIACIÓN AL COMPRADOR
¡Tenemos en exclusiva un piso para ti!
Disponemos de un piso en edificio residencial que puedes adquirir en pr
";san-blas
203.000;Piso en Calle de Yecla Simancas;48;2;Planta 2ª exterior con ascensor;/inmueble/108732236/;"
Estupenda oportunidad piso de 2 habitaciones y 1 baño, en Simancas.
48 m2 construidos. 44 m2 útiles. Orientación Este.
Salón de 14 m2.
Cocina amueblada y equipada.
Calefacción eléctrica.
Suelo de gres, ventanas de aluminio y puertas demadera.
Ascensor.
NO PIERDA ESTA OPORTUNIDAD Y CONTACTE CON NOSO
";san-blas
140.000;Piso en Calle de la Hojalatería Amposta;56;2;Planta 3ª exterior sin ascensor;/inmueble/107455450/;"
INMUEBLE OKUPADO
Inmueble sin posesión y sin acceso al interior. Las fotografías del interior y las características del activo, pueden no ajustarse al estado actual.
NO COBRAMOS COMISIÓN DE INTERMEDIACIÓN AL COMPRADOR
¡Tenemos en exclusiva un piso para ti!
Disponemos de un piso en edificio residencial que puedes ad
";san-blas
380.000;Piso en Calle de Valdecanillas Simancas;108;4;Bajo exterior sin ascensor;/inmueble/108526934/;"
Fantástico bajo de 4 habitaciones y 3 baños, en Simancas.
108 m2 construidos. 98 m2 útiles. Orientación Este.
Salón de paso de 16 m2.
Cocina amueblada y equipada.
Calefacción.
Armarios empotrados, suelo porcelánico y ventanas de PVC.
NO PIERDA ESTA OPORTUNIDAD Y CONTACTE CON NOSOTROS PARA REALIZAR UNA
";san-blas
445.000;Piso en Calle Aramayona 5;120;4;Planta 1ª exterior con ascensor;/inmueble/109240947/;"
Descubre tu nuevo hogar en este espectacular piso! Con 120 m² construidos, esta vivienda cuenta con 4 dormitorios y 2 baños uno de ellos en suite, perfectos para disfrutar de la comodidad y el espacio que mereces. Está ubicada en una urbanización con portero físico. Además, cuenta con jardín y piscina infantil y para a
";san-blas
360.000;Piso en Calle de Pirra 44;97;2;Planta 1ª exterior con ascensor;/inmueble/108689113/;"
Tecnocasa Estudio Rejas - Las Musas S. L
Vende magnifico *APARTAMENTO TURISTICO* situado en el corazón del Barrio de Rejas,
La vivienda consta de:
-2 habitaciones.
-Cocina.
-2 baños.
-2 armarios empotrados.
-Salón Amplio y luminoso
-Pista de pádel.
-Gimnasio.
-Piscina.
-Plaza de garaje incluida en el precio.
-Portero
";san-blas
480.000;Chalet en Calle Mayo Rejas;250;4;;/inmueble/107907698/;"
 OPORTUNIDAD DE INVERSIÓN: PROPIEDAD EN PROCESO DE SUBASTA
 Casa con Jardín y Parking en Ambite (Madrid).
Está ubicada en la Calle Mayo 39B, en el municipio de Ambite, al sureste de la Comunidad de Madrid. Una zona tranquila, rodeada de naturaleza, ideal para quienes buscan espacio y calidad de vida a menos de una h
";san-blas
450.000;Piso en Calle de Aquitania Arcos;120;3;Planta 1ª exterior con ascensor;/inmueble/109168125/;"
Se vende estupendo piso exterior de 120 m² en la zona de Las Rosas, una de las áreas residenciales más tranquilas y demandadas de Madrid. La vivienda se encuentra en una urbanización privada que ofrece seguridad, comodidad y un entorno ideal para disfrutar en familia.
La casa está situada en una primera planta muy lum
";san-blas
329.999;Piso en Calle de Julián Camarillo Simancas;240;1;Planta 1ª exterior con ascensor;/inmueble/107787945/;"
Tecnocasa Suanzes-Salvador te invita a descubrir la oportunidad de establecer tu negocio o diseñar tu nuevo hogar desde 0 en un espacio excepcional, un inmueble en primera planta de un edificio moderno construido en 1992, que ofrece 240,65 metros cuadrados de amplitud diáfana, listos para adaptarse a tus necesidades y
";san-blas
550.000;Piso en Calle Conrado del Campo Salvador;137;3;Planta 1ª exterior con ascensor;/inmueble/108885839/;"
Tecnocasa ofrece en exclusiva estupendo piso ubicado en el prestigioso barrio Salvador–Arturo Soria, una de las zonas residenciales más demandadas de Madrid. Presentamos una oportunidad única para adquirir este inmueble, situado en la codiciada Calle Conrado del Campo. Este inmueble, con una superficie construida de 13
";san-blas
250.000;Chalet pareado en Calle de Egipto Simancas;96;3;;/inmueble/108585295/;"
Bastia Inmobiliaria presenta esta Casa Dominguera con encanto, para reformar y con inquilino hasta Junio 2026.
Este inmueble se encuentra situado en el barrio de Simancas, una zona consolidada y bien comunicada de Madrid. Ideal tanto como para inversión como para proyecto de reforma personalizada.
La vivienda se dist
";san-blas
230.000;Piso en Simancas Madrid;50;3;Bajo exterior sin ascensor;/inmueble/108681111/;"
¡Oportunidad única junto al metro de Simancas! Piso reformado con encanto y ubicación inmejorable
Si buscas un hogar listo para entrar a vivir, con estilo, comodidad y a un paso del metro… ¡este piso es para ti!
Te presentamos esta joya en planta baja, completamente exterior, situada en un edificio sin ascensor pero
";san-blas
339.000;Piso en Calle del Castillo de Simancas Simancas;120;3;Planta 6ª exterior con ascensor;/inmueble/109149674/;"
Tecnocasa Suanzes Salvador Vende Piso:
Si estás buscando un hogar espacioso, bien comunicado y con terrazas donde disfrutar del aire libre sin salir de casa, esta puede ser tu oportunidad.
Este piso de 120 m² se encuentra en una 6ª planta con ascensor, lo que le da una luminosidad excepcional y unas vistas despejadas
";san-blas
155.000;Piso en Calle de los Aparejadores 12;62;2;Planta 4ª exterior sin ascensor;/inmueble/109240134/;"
¡Descubre tu nuevo hogar en este encantador piso de dos dormitorios, recientemente reformado y listo para entrar a vivir! Situado en una cuarta planta sin ascensor, este luminoso apartamento exterior ofrece un acogedor salón que se convierte en el corazón del hogar. La cocina está perfectamente equipada y el baño ha si
";san-blas
915.000;Piso en Calle del Doctor Zamenhof Salvador;138;2;Bajo exterior con ascensor;/inmueble/109125422/;"
Bajo con Jardín Privado en Exclusiva Urbanización – Arturo Soria, Madrid
En el corazón de Arturo Soria, una de las zonas residenciales más distinguidas de Madrid, se encuentra esta extraordinaria vivienda a estrenar que redefine el concepto de lujo y confort en la capital.
Con una superficie de 82 m² y un jardín priva
";san-blas
