precio;localidad;tamanio;habitaciones;descripcion;link;descripcion_larga;distrito
549.000;Piso en Plaza de España Casco Antiguo;230;5;Planta 1ª exterior con ascensor;/inmueble/106221233/;"
¿BUSCAS UN PISO DE GRAN TAMAÑO, EN PLENO CENTRO DE LEGANES? ¡ESTA ES TU OPORTUNIDAD!
Progreso Vende, estupenda vivienda en calle Plaza de España, en uno de los edificios más emblemáticos del centro, junto al antiguo ayuntamiento. Se compone de doble entrada (principal y de servicio); amplio salón con terraza; tres ha
";leganes-madrid
420.000;Piso en Calle de Alcalá de Henares 10;152;3;Planta 3ª exterior con ascensor;/inmueble/93107005/;"
Vivienda y anejos de renta libre construida en 2004. Disponible a partir de septiembre de 2025. Certificado energético en consumo y emisiones “D” Tercera y última planta sin edificios delante con orientación sur - este de 152m2 brutos y 78.90m2 útiles distribuida en vestíbulo (3.95m2), salón - comedor independiente (19
";leganes-madrid
700.000;Ático en Avenida Juan XXIII Solagua;93;3;Planta 5ª exterior con ascensor;/inmueble/108546090/;"
AGENCIA INMOBILIARIA EL BLOQUE ofrece en Exclusiva: ÁTICO de Obra Nueva en Leganés en Paseo Juan XXIII.
La vivienda tiene una fabulosa terraza con vistas despejadas y privacidad.
¡Descubre tu nuevo hogar en este espectacular ático de obra nueva en Leganés, situado en el Paseo Juan XXIII! Con 93 m² construidos, este
";leganes-madrid
547.603;Chalet adosado en CL Oporto 96;243;5;;/inmueble/109013560/;"
Vivienda XXI vende en exclusiva chalet adosado de 243 m² construidos sobre parcela de 180 m², construido en 2005 y diseñado para quienes buscan espacio, confort y calidad de vida.
Su distribución en varias plantas ofrece estancias amplias y luminosas:
Zona de día en planta baja, con un salón comedor espacioso y salid
";leganes-madrid
149.000;Piso en Calle de las Alpujarras Zarzaquemada;45;1;Bajo exterior sin ascensor;/inmueble/107276625/;"
La casa de tus sueños pone a su disposición este magnífico espacio para transformar de 45m2
Se compone de un dormitorio grande y luminoso, salón comedor con cocina americana, baño completo con plato de ducha. PUERTA POR EL PORTAL!
Situado en una zona residencial rodeado de comercios y medios de transporte.
La casa de t
";leganes-madrid
250.000;Piso en Calle de Nuestra Señora de Guadalupe Vírgenes;61;3;Planta 3ª exterior con ascensor;/inmueble/109215995/;"
**Piso en Venta en Leganés - ¡Tu nuevo hogar te espera! **
Descubre este encantador piso de 61 m² en una ubicación inmejorable de Leganés. Situado en la tercera planta de un edificio con ascensor, este hogar ofrece un salón independiente que se abre a una acogedora terracita de 5 m², perfecta para disfrutar del aire f
";leganes-madrid
165.000;Piso en Calle Indias Descubridores-Escritores;65;3;Planta 4ª exterior sin ascensor;/inmueble/109408569/;"
¡Descubre tu nuevo hogar en Leganés! Este encantador piso de 60 metros cuadrados se encuentra en una de las mejores zonas de la ciudad, ideal para disfrutar de la vida urbana sin renunciar a la tranquilidad.
Con 3 amplios dormitorios, uno de ellos doble, hay espacio suficiente para toda la familia o para crear tu ofi
";leganes-madrid
199.900;Piso en Calle Mallorca San Nicasio;63;2;Planta 3ª exterior sin ascensor;/inmueble/109346843/;"
HOGAR IDEAL INMOBILIARIA presenta:
Piso en venta en San Nicasio.
Te presentamos esta acogedora vivienda de 63 m², ubicada en en el barrio de San Nicasio, ideal tanto para vivir como para invertir.
La vivienda se distribuye en:
Hall de entrada que da la bienvenida al hogar.
Cocina independiente con tendedero, práct
";leganes-madrid
695.000;Dúplex en Plaza Fuente Honda Casco Antiguo;234;4;Planta 3ª exterior con ascensor;/inmueble/109241066/;"
HOGAR IDEAL INMOBILIARIA vende exclusivo ATICO-DUPLEX con DOS GRANDES TERRAZAS en pleno casco antiguo de Leganés.
El inmueble cuenta con unas dimensiones de 234 m2 según datos catastrales y consta de dos plantas, DOS PLAZAS DE GARAJE Y TRASTERO.
La planta baja esta distribuido por hall de entrada, gran pasillo distri
";leganes-madrid
625.000;Chalet adosado en Calle Libertades Derechos Humanos;220;6;;/inmueble/109144719/;"
HOGAR IDEAL INMOBILIARIA vende magnífico chalet adosado de 220m² con cuatro plantas.
Está ubicado en el barrio residencial de Derechos Humanos, en un entorno muy tranquilo, agradable y rodeado de zonas verdes, a tan solo 10 minutos del centro urbano de Leganés y de la estación de Cercanías Renfe.
La vivienda fue cons
";leganes-madrid
239.000;Piso en Calle Nápoles 2;74;3;Planta 1ª exterior con ascensor;/inmueble/108725628/;"
Estupenda vivienda situada en el corazón de Leganés, a cinco minutos de la Universidad Carlos III.
La vivienda consta de salón exterior, con terraza de 8m2, cocina muy amplia con todos los muebles, electrodomésticos y encimera de silestone. Tres dormitorios y un baño completo.
Calefacción con caldera de gas y radia
";leganes-madrid
235.000;Piso en Avenida Rey Juan Carlos I Zarzaquemada;73;3;Planta 7ª exterior con ascensor;/inmueble/108595021/;"
 Se vende piso de 3 dormitorios con 2 terrazas y trastero en Avenida Rey Juan Carlos I, Leganés – Frente al Metro Julián Besteiro
Te ofrecemos esta excelente vivienda amueblada, exterior y muy luminosa, situada en plena Avenida Rey Juan Carlos I, justo frente a la estación de metro Julián Besteiro (Línea 12 – Metrosur
";leganes-madrid
470.000;Piso en Avenida Juan XXIII 13;131;4;Planta 1ª exterior con ascensor;/inmueble/108019715/;"
Excelente vivienda de 4 dormitorios con terraza en una inmejorable ubicación – lista para entrar a vivir.
El precio incluye 2 plazas de garaje y fácil maniobrabilidad (una de ellas con fácil acceso a personas con movilidad reducida) y un amplio trastero.
Se trata de una vivienda seminueva con una superficie útil aproxi
";leganes-madrid
280.000;Piso en Avenida de María Moliner 8;70;2;Bajo exterior con ascensor;/inmueble/108741480/;"
Oportunidad directamente de particular, abstenerse agencias.
Piso en Leganés Norte, es un bajo exterior con ascensor. Se distribuye en dos habitaciones, un baño con plato de ducha, salón y cocina con salida a un patio de 40 m2. Dispone de aire acondicionado en salón y armarios empotrados.
Ubicación inmejorable cerca de
";leganes-madrid
255.000;Estudio en Avenida del Dos de Mayo Batallas;;141;;/inmueble/107863533/;"
PRODUCTO EN CESION DE REMATE ESPECIAL PARA INVERSORES - SIN FINANCIACIÓN –NO SE PUEDE VISITAR Piso+garaje de 141 m2 ubicada en  Avenida dos de Mayo, en Leganés (Madrid)  Oportunidad de adquisición por un precio significativamente inferior y obtención de márgenes elevados. RENTABILIDAD GARANTIZADA. No admite crédito hip
";leganes-madrid
200.000;Chalet adosado en Calle del Seminario Vírgenes;52;1;;/inmueble/109392351/;"
Título sugerido:
Parcela urbana de 82 m² con casa de 52 m² en el centro de Leganés – ideal para inversores
Descripción:
Se vende parcela situada en suelo urbano, ubicada en pleno centro de Leganés. Superficie de 82 metros cuadrados con una construcción existente de 52 metros cuadrados (vivienda o pequeña edificación)
";leganes-madrid
210.000;Piso en Avenida de la Libertad La Fortuna;108;2;Bajo exterior sin ascensor;/inmueble/108420801/;"
Activo adjudicado en subasta sin posesión.
Actualmente, no es posible realizar visitas al interior del inmueble. Las fotografías pueden no reflejar el estado actual de la propiedad.
El precio del inmueble ha sido fijado en atención a que el inmueble se adquiera por el comprador en estado de ocupado por lo que no apli
";leganes-madrid
250.000;Piso en Vírgenes Leganés;72;3;Planta 4ª exterior con ascensor;/inmueble/109357727/;"
Arquipisos Gestión: Pone a la venta este piso en una de las zonas más tranquilas y bien comunicadas de Leganés.
La vivienda cuenta con 72 m² construidos y se encuentra en una cuarta planta con ascensor. Gracias a su orientación y a ser completamente exterior, disfruta de una excelente entrada de luz natural durante to
";leganes-madrid
138.000;Piso en Calle Santo Ángel Santos;61;4;Bajo exterior sin ascensor;/inmueble/108727657/;"
PISO OCUPADO POR PERSONA SIN JUSTO TÍTULO (Antiguo Deudor Hipotecario)
ESTE INMUEBLE DEBIDO A SU ESTADO OCUPACIONAL NO ADMITE VISITAS
IDEAL PARA INVERSORES
LA LOCALIZACIÓN DEL INMUEBLE ES APROXIMADA
Vivienda de 61 m², según Catastro, y 3 m² de elementos comunes a la venta en el municipio de Leganés, Madrid.
La vivienda
";leganes-madrid
250.000;Piso en La Fortuna Leganés;98;3;Planta 2ª exterior sin ascensor;/inmueble/109403645/;"
Agencia inmobiliaria de Leganés zona La Fortuna TECNOCASA Estudio Inmobiliario La Fortuna:
EN VENTA: PISO DÚPLEX EN VENTA, con una excelente distribución,
PRIMERA PLANTA: dispone de recibidor, amplio salón-comedor con A/A, cocina independiente, lavadero - cuarto de caldera y aseo.
SEGUNDA PLANTA: Tres amplios dormi
";leganes-madrid
239.000;Piso en Avenida de Europa Zarzaquemada;78;3;Bajo exterior con ascensor;/inmueble/109190974/;"
Se vende piso en Av. de Europa. Zarzaquemada. Leganés.
78 m2 construidos. 73 m2 útiles.
Distribuidos en:
Hall de entrada con armario empotrado.
Cocina totalmente amueblada y equipada con electrodomésticos.
Salón independiente muy amplio y luminoso.
Baño totalmente reformado y adaptado para persona con silla de ruedas.
";leganes-madrid
190.000;Piso en La Fortuna Leganés;55;2;Entreplanta exterior sin ascensor;/inmueble/109386439/;"
Agencia inmobiliaria de Leganés zona La Fortuna Tecnocasa Estudio Inmobiliario La Fortuna:
EN VENTA: EXCELENTE PISO EN VENTA, TOTALMENTE REFORMADO.
Este inmueble cuenta con una excelente distribución: dispone de entrada, amplio salón-comedor, cocina independiente, baño completo con plato de ducha, dos amplios dormit
";leganes-madrid
225.000;Piso en Plaza de la Flor Flores;63;3;Bajo exterior sin ascensor;/inmueble/106187797/;"
CHENEL ofrece este encantador piso de 64 m² te ofrece una vida cómoda y moderna, gracias a su reciente reforma. El piso cuenta con tres acogedores dormitorios y dos baños, ideales para familias o para quienes buscan espacio extra.
Ubicado a un paso de la emblemática plaza de toros La Cubierta y a escasos metros de la p
";leganes-madrid
239.000;Piso en Calle del Ártico Casco Antiguo;89;3;Planta 4ª exterior con ascensor;/inmueble/108095822/;"
¡OPORTUNIDAD EN EL CENTRO DE LEGANES! PISO DE 3 HABITACIONES CON TERRAZA
Se vende piso en Leganés centro, situado en la calle Artico, una ubicación inmejorable con todos los servicios a mano: transporte público, comercios, colegios y zonas verdes.
la vivienda se encuentra en una cuarta planta, muy luminosa, con ascen
";leganes-madrid
659.900;Chalet adosado en Valdepelayo-Montepinos-Arroyo Culebro Leganés;208;4;;/inmueble/109289116/;"
MAYA Consulting vende CHALET de ESQUINA EXCLUSIVO EN ARROYO CULEBRO – LEGANÉS!
¡Vive en uno de los barrios más demandados del sur de Madrid! Te presentamos este espectacular chalet adosado de esquina en Arroyo Culebro, una zona residencial muy codiciada por su tranquilidad, excelente comunicación y calidad de vida rod
";leganes-madrid
300.000;Piso en Avenida de Europa Zarzaquemada;84;3;Planta 9ª exterior con ascensor;/inmueble/109311929/;"
GRUPO ACP INMOBILIARIA vende vivienda ubicada en Avenida de Europa, Zarzaquemada Leganés.
El interior destaca por su gran luminosidad. El salón-comedor es un espacio amplio y con una luz envidiable. Cuenta con 3 habitaciones y un baño moderno. La cocina, equipada con electrodomésticos de primera calidad, te lo pone fá
";leganes-madrid
209.500;Piso en Calle de Zaragoza Las Dehesillas-Vereda de los Estudiantes;60;1;Planta 2ª exterior con ascensor;/inmueble/108761661/;"
++++++++++BASTIA INMOBILIARIA+++++++++
- Ponemos a la venta un magnifico inmueble en una de las mejores zonas de Leganés.
-El inmueble se entregara en un periodo aproximado de 10-12 meses completamente reformado
- El inmueble ubicado en la segunda planta se distribuye del siguiente modo:
- En la planta de acceso en
";leganes-madrid
299.500;Dúplex en Calle de Zaragoza Las Dehesillas-Vereda de los Estudiantes;86;2;Planta 1ª exterior con ascensor;/inmueble/108748594/;"
++++++++++BASTIA INMOBILIARIA+++++++++
- Ponemos a la venta un magnifico inmueble en una de las mejores zonas de Leganés.
-El inmueble se entregara en un periodo aproximado de 10-12 meses completamente reformado
- El inmueble ubicado en la primera planta se distribuye en 2 ambientes del siguiente modo:
- En la plan
";leganes-madrid
209.500;Dúplex en Calle de Zaragoza Las Dehesillas-Vereda de los Estudiantes;60;1;Planta 3ª interior con ascensor;/inmueble/108763400/;"
++++++++++BASTIA INMOBILIARIA+++++++++
- Ponemos a la venta un magnifico inmueble dúplex en una de las mejores zonas de Leganés.
-El inmueble se entregara en un periodo aproximado de 10-12 meses completamente reformado
- El inmueble ubicado en la tercera planta se distribuye en 2 plantas del siguiente modo:
- En la
";leganes-madrid
238.000;Piso en Calle de la Rioja Zarzaquemada;69;3;Entreplanta exterior con ascensor;/inmueble/109159933/;"
Entreplanta con altura de primer piso. ¡Descubre tu nuevo hogar en esta espectacular entreplanta reformada! Este luminoso piso de 69 m² cuenta con 3 acogedores dormitorios y un baño moderno, ideal para disfrutar de la comodidad y el estilo. La vivienda, situada a pocos pasos del Metro Julián Besteiro, ofrece un acceso
";leganes-madrid
380.000;Dúplex en V Centenario Leganés;100;3;Planta 3ª exterior con ascensor;/inmueble/108311381/;"
IMPERIAL servicios inmobiliarios ofrece este encantador dúplex en el barrio V Centenario de Leganés!
Situado en una urbanización con bonitas zonas verdes, piscina, portero físico, área infantil, pista de baloncesto y fútbol, este hogar combina comodidad y ocio en un entorno privilegiado.
La vivienda se distribuye en d
";leganes-madrid
129.000;Estudio en Avenida de Fuenlabrada Casco Antiguo;Bajo;35;;/inmueble/108466938/;"
La casa de tus sueños les ofrece este espacio para transformar, después de hacer la reforma será un bonito estudio loft muy luminoso, un ambiente moderno y agradable para una pareja o persona sola.
Contará con una cocina americana incorporada en el salón comedor, un área de descanso que podrá ser utilizado a modo de do
";leganes-madrid
183.500;Piso en Casco Antiguo Leganés;50;2;Bajo exterior sin ascensor;/inmueble/109360819/;"
HOGARES LEGANES vende oportunidad única en Leganés! Se vende piso tipo estudio de 45 metros cuadrados en una de las mejores zonas de la ciudad. Actualmente se encuentra en proceso de reforma y el precio incluye la entrega con una reforma integral con altas calidades donde tienes la posibilidad de elegir los acabados de
";leganes-madrid
280.000;Piso en Calle Ribeiro Zarzaquemada;71;3;Planta 1ª exterior con ascensor;/inmueble/109018286/;"
Agencia inmobiliaria de Leganés zona Zarzaquemada, Tecnocasa Area Inmoleganes 2024 Sl.
EN VENTA: Excelente vivienda reformada completamente exterior muy luminosa en Leganés (Zarzaquemada)
Piso en ZARZAQUEMADA, listo para entrar a vivir. 1º planta de 71m2, Compuesto de 3 dormitorios, salón, cocina, baño y terraza.
Co
";leganes-madrid
398.900;Piso en Plaza José Luis López Aranguren Valdepelayo-Montepinos-Arroyo Culebro;98;4;Planta 2ª exterior con ascensor;/inmueble/107207670/;"
Acacia Wellness ofrece en VENTA:
¡Oportunidad única en Leganés! Este encantador piso en venta, ubicado en una segunda planta con ascensor, ofrece 98 m² distribuidos de manera eficiente para tu comodidad. Al entrar, te recibe un acogedor hall que da paso a un amplio salón perfecto para tus momentos de relax. La cocina a
";leganes-madrid
137.005;Piso en Plaza de los Ríos San Nicasio;58;2;Planta 1ª exterior sin ascensor;/inmueble/108303194/;"
¿Buscas vivienda en la Zona Sur de Madrid?
Century 21 Now IV Te ofrece la oportunidad de adquirir éste Piso en la localidad de Leganés. Situado en la zona de San Nicasio.
Piso en edificio residencial que puedes adquirir en propiedad, con una superficie de 58 m² muy bien distribuido en 2 dormitorios y 1 baño.
OPORTUN
";leganes-madrid
200.000;Piso en Calle del Priorato Zarzaquemada;66;3;Bajo exterior con ascensor;/inmueble/108483139/;"
Agencia inmobiliaria de Leganés zona Zarzaquemada, Tecnocasa Area Inmoleganes 2024 Slu
Vende vivienda en la calle PRIORATO compuesta de 3 Dormitorios, Salón, Cocina y Baño.
Zona perfecta para las familias con zonas verdes en el entorno, bloque muy tranquilo
Piso completamente exterior a reformar.
Posibilidad de pis
";leganes-madrid
137.005;Piso en Plaza de los Ríos San Nicasio;58;2;Planta 1ª exterior sin ascensor;/inmueble/108303194/;"
¿Buscas vivienda en la Zona Sur de Madrid?
Century 21 Now IV Te ofrece la oportunidad de adquirir éste Piso en la localidad de Leganés. Situado en la zona de San Nicasio.
Piso en edificio residencial que puedes adquirir en propiedad, con una superficie de 58 m² muy bien distribuido en 2 dormitorios y 1 baño.
OPORTUN
";leganes-madrid
214.000;Piso en Calle de Madrid Casco Antiguo;83;3;Planta 3ª interior sin ascensor;/inmueble/108303237/;"
¿Buscas vivienda en la Zona Sur de Madrid?
Century 21 Now IV Te ofrece la oportunidad de adquirir éste Piso en la localidad de Leganés. Situado en la zona centro del Municipio.
Piso en edificio residencial que puedes adquirir en propiedad, con una superficie de 83 m² muy bien distribuido en 3 dormitorios y 1 baño.
";leganes-madrid
380.000;Piso en Plaza Jose Luis López Aranguren Valdepelayo-Montepinos-Arroyo Culebro;123;4;Planta 3ª exterior con ascensor;/inmueble/107832125/;"
LEGANES - PLAZA JOSE LUIS LOPEZ ARANGUREN - Excelente vivienda situada en la tercera planta del edificio con ascensor.
Se distribuye en 4 amplios dormitorios, 2 baños, salón comedor y cocina amueblada con doble comunicación, trastero y garaje.
CALIDADES - Ventanas lacadas en blanco con climalit, suelos en parquet, pu
";leganes-madrid
250.000;Piso en Calle de la Rioja Zarzaquemada;69;3;Bajo exterior con ascensor;/inmueble/108730236/;"
VIVIENDA EN BUEN ESTADO en una de las mejores zonas de Leganés y más demandadas. Ideal como vivienda propia o para el mercado de alquiler. Ubicada en la planta baja del edificio da a una calle peatonal lo que proporciona tranquilada y evita los ruidos propios del tráfico.
Consta de amplia cocina con acceso al patio de
";leganes-madrid
625.000;Chalet adosado en Calle Libertades Derechos Humanos;250;6;;/inmueble/108860041/;"
AGIL Inmobiliaria vende, CHALET UBICADO EN EL CENTRO DE LEGANÉS (Barrio Los Tilos) La vivienda está distribuida:
SÓTANO: En esta planta contamos con un amplio apartamento distribuido en dormitorio, gran salón, cocina, dormitorio, baño, despensa y trastero. Sobre esta planta se encuentra el garaje a pie de calle y part
";leganes-madrid
174.000;Piso en Calle de la Bureba Zarzaquemada;65;2;Bajo exterior con ascensor;/inmueble/107929503/;"
La casa de tus sueños pone a su disposición este magnífico espacio para transformar de 70m2
Se compone de dos dormitorios uno doble y otro individual, salón comedor con cocina americana, baño completo con plato de ducha y vestidor.
Situado en una zona residencial rodeado de comercios y medios de transporte.
La casa de
";leganes-madrid
151.000;Piso en Calle de Fray Luis de Leon s/n;60;3;Planta 4ª exterior sin ascensor;/inmueble/107878878/;"
¡Una oportunidad perfecta para invertir con retorno asegurado!
Este luminoso y acogedor piso se encuentra ubicado en la cuarta planta de un edificio con acceso fácil y cómodo, con una excelente ubicación sobre la calle principal. La propiedad consta de:
3 habitaciones: Espaciosas y bien distribuidas, ideales para fam
";leganes-madrid
150.000;Finca rústica en Camino Prolongación Parque Polvoranca 2;80;1;;/inmueble/109047190/;"
Se vende espectacular finca rústica de 1000m² situada en Parque Polvoranca, cerca del lago y de la hípica. Cuenta con varias casetas para herramienta y almacenaje, dos boxes para caballos y dos estancias; una mobil home (con baño completo, dormitorio, salón y cocina americana) y una caseta de madera para uso recreativo
";leganes-madrid
229.900;Piso en Descubridores-Escritores Leganés;93;2;Planta 2ª exterior con ascensor;/inmueble/108530540/;"
Inmobiliarias Encuentro vende magnífico piso en Leganés en la Zona Flores.
El inmueble de 93 m2, cuenta con espacioso hall, amplio salón comedor, el cual dispone de una amplia terraza que da a unas preciosas vistas, dispone de cocina amueblada y equipada, dos dormitorios (anteriormente tres) cada uno con ventanas que
";leganes-madrid
129.000;Estudio en Avenida de Fuenlabrada Casco Antiguo;Bajo;35;;/inmueble/108814428/;"
La casa de tus sueños les ofrece este espacio para transformar, después de hacer la reforma será un bonito estudio loft muy luminoso, un ambiente moderno y agradable para una pareja o persona sola.
Contará con una cocina americana incorporada en el salón comedor, un área de descanso que podrá ser utilizado a modo de do
";leganes-madrid
689.000;Casa o chalet independiente en Valdepelayo-Montepinos-Arroyo Culebro Leganés;288;5;;/inmueble/109129773/;"
MAYA Consulting vende INMEJORABLE CHALET de esquina con un gran patio, delantero, lateral y trasero en Arroyo Culebro - Leganés. ¡Atención, amantes de la comodidad y la practicidad en Arroyo Culebro Leganés! Os traemos esta joya inmobiliaria que te hará latir el corazón más fuerte que nunca.
Este maravilloso chalet, s
";leganes-madrid
211.900;Piso en Calle Nuestra Señora de la Merced Vírgenes;66;3;Planta 1ª exterior sin ascensor;/inmueble/107799882/;"
La casa de tus sueños pone a su disposicion este bonito piso en el centro de Leganés
Este inmueble consta de tres dormitorios, uno principal con armario empotrado y dos individuales, uno de ellos con bomba de frio y calor, todos los dormitorios son exteriores a la calle
Salòn comedor con terraza, cuenta también con bom
";leganes-madrid
137.005;Piso en Pz Rios De Los 9;88;2;Planta 1ª exterior sin ascensor;/inmueble/109123067/;"
Vivienda alquilada imposibilidad de visita interior
finalizacion de contrato 30/11/2029 renta 283,97.
";leganes-madrid
164.000;Piso en Camino CL Virgen Del Vírgenes;62;2;Bajo exterior con ascensor;/inmueble/108774609/;"
Edoras Gestión Inmobiliaria pone a su disposición esta vivienda estratégicamente situada en el centro de Leganés, Compuesta de entrada, cocina de amplias dimensiones, amplio salón, 2 dormitorios y baño. Situada en planta baja, no cuenta con ninguna barrera arquitectónica. Ascensor pendiente de inicio de obras. La vivie
";leganes-madrid
697.000;Chalet adosado en Valdepelayo-Montepinos-Arroyo Culebro Leganés;280;5;;/inmueble/109160592/;"
GRAN OPORTUNIDAD DE CHALET ADOSADO DE 280M2 CON ORIENTACION Y VENTILACION CRUZADA (este-oeste).
La ubicación es inmejorable, ofreciendo tranquilidad y privacidad, estando al lado de ""Parque Polvoranca"", se disfruta de este espacio natural, (de diversas rutas y parques) en cualquier época del año.
La comunicación es p
";leganes-madrid
300.000;Piso en Avenida de Europa 61;92;3;Planta 9ª exterior con ascensor;/inmueble/109223153/;"
Este precioso piso de 84 m² combina estilo moderno con comodidad. Cuenta con 3 habitaciones amplias, 1 baño, salón-comedor muy luminoso y una cocina equipada con electrodomésticos de alta gama. Su orientación garantiza luz natural todo el día.
Además, dispone de buenas vistas, con suelo de parquet, aire acondicionado,
";leganes-madrid
239.900;Dúplex en La Fortuna Leganés;142;3;Planta 3ª exterior con ascensor;/inmueble/109161888/;"
Presentamos este ático dúplex en tercera planta, con 142 m² y contrato de alquiler vigente hasta el 21 de diciembre de 2027 (los inquilinos llevan desde el 21 de diciembre de 2022, abonando una renta de 927 € mensuales). La vivienda se distribuye de la siguiente forma:
•Planta baja: Cocina, una habitación, baño complet
";leganes-madrid
423.000;Casa o chalet independiente en Avenida de María Moliner Leganés norte;231;4;;/inmueble/103985027/;"
***INMUEBLE SIN POSESIÓN***
***SOLO PARA INVERSORES***
***SIN COMISIONES DE AGENCIA INMOBILIARIA***
Oportunidad de inversión: inmueble procedente de ejecución hipotecaria sin posesión
Imposibilidad de visita interior.
Las fotografías pueden no corresponderse con el estado actual del inmueble.
El precio del inmueble
";leganes-madrid
399.999;Piso en El Carrascal Leganés;118;4;Planta 6ª exterior con ascensor;/inmueble/109310188/;"
VIVIENDAS365-VENDE- ¡Descubre tu nuevo hogar en El Carrascal, Leganés! Este espectacular pi so reformado EN BLOQUE ESTRELLA es ideal para quienes buscan comodidad y luminosidad.
Cuenta con un amplio hall recibidor que te da la bienvenida, además de un armario empotrado
que maximiza el espacio.
La cocina, espaciosa
";leganes-madrid
369.000;Piso en Casco Antiguo Leganés;118;3;Planta 3ª exterior con ascensor;/inmueble/109264541/;"
Te presentamos este maravilloso piso en pleno centro de Leganés, un hogar pensado para disfrutar de la comodidad y la tranquilidad sin renunciar a una ubicación inmejorable.
Con tres amplios dormitorios y dos baños, esta vivienda es perfecta para quienes buscan espacio y calidad de vida.
Además, cuenta con acceso a u
";leganes-madrid
195.000;Piso en Avenida Doctor Mendiguchía Carriche 2;56;2;Bajo exterior sin ascensor;/inmueble/108807109/;"
! tambien disponible venta a plazos a dos años por 225.000€! .
pagando 1.000€/mes! se descuenta el 100% de lo abonado mensual!
se vende piso bajo recien reformado.
Piso bajo muy luminoso a metros de la estacion de cercanias leganes central y cercano a la de metrosur san nicasio, leganes.
Solo contactos por whatsapp.
La
";leganes-madrid
