precio,localidad,tamanio,habitaciones,descripcion,link,descripcion_larga,distrito
630.000,Piso en Marroquina Madrid,142,3,Planta 8ª exterior con ascensor,/inmueble/108251046/,"
**Exclusiva oportunidad en Moratalaz**
En el emblemático barrio de Moratalaz, específicamente en la zona de Marroquina, se encuentra este magnífico piso en altura que destaca por su excelente distribución. Con una superficie construida de 142 m², esta propiedad cuenta con tres amplios dormitorios, dos baños completos
",moratalaz
270.000,Piso en Av Moratalaz Vinateros,62,2,Bajo exterior sin ascensor,/inmueble/109117524/,"
Agencia inmobiliaria de MADRID – zona MORATALAZ – CAMINO DE LOS VINATEROS - PICO DE ARTILLEROS - CORREGIDOR DE JUAN DE BOBADILLA – TECNOCASA - VENDE - GRAN OPORTUNIDAD.
¡Oportunidad única en Moratalaz! Piso amplio de 62 m²+ 7 m² de trastero, ubicado en una zona verde y muy tranquila, te ofrece todo lo que necesitas pa
",moratalaz
349.000,Piso en Calle de la Hacienda de Pavones Fontarrón,75,2,Planta 2ª exterior con ascensor,/inmueble/109079791/,"
VOhome Propiedades Moratalaz pone a disposición esta vivienda REFORMADA A ESTRENAR CON ASCENSOR APROBADO EN JUNTA en la calle Hacienda de pavones.
91_032_73_67 Somos especialistas en cambios de vivienda, consúltanos como hacemos el proceso, totalmente diferente y ajustado a las necesidades de cada cliente!
Exclusiva
",moratalaz
650.000,Piso en Media Legua Madrid,118,3,Planta 7ª exterior con ascensor,/inmueble/108574284/,"
VOhome Quintana, vende fabuloso piso reformado de 118 m2 en séptima planta con ascensor, en barrio Moratalaz.
Piso exterior, con doble orientación, sureste y noroeste, ventilación cruzada, con vistas abiertas a parques, zonas ajardinadas y a la piscina de la propia urbanización.
Piso con un gran recibidor con armario
",moratalaz
420.000,Piso en Calle de la Marroquina Marroquina,90,3,Planta 5ª exterior con ascensor,/inmueble/108948511/,"
Descubre este luminoso y espacioso piso en la zona de Moratalaz, en el distrito de Moratalaz, en la zona de marroquina, en pleno centro de ocio de Moratalaz, construido en 1970. la vivienda cuenta con una superficie de 90 metros cuadrados, repartidos en 3 habitaciones y 2 baños, uno de ellos con plato de ducha. ventana
",moratalaz
365.000,Piso en Avenida de Moratalaz Vinateros,73,3,Planta 1ª exterior sin ascensor,/inmueble/108918029/,"
VOhome pone a disposición esta vivienda REFORMADA en la Avenida de Moratalaz
91_032_73_67 Somos especialistas en cambios de vivienda, consúltanos como hacemos el proceso, totalmente diferente y ajustado a las necesidades de cada cliente!
Luminoso piso reformado al detalle en primera planta con una superficie de 73m²,
",moratalaz
738.000,Ático en Calle Laguna Negra Horcajo,140,3,Planta 6ª exterior con ascensor,/inmueble/108981322/,"
Amabit vende exclusivo ático en Calle Laguna Negra.
Presentamos este magnífico ático de 140 m² situado en una urbanización privada con piscina comunitaria y zonas ajardinadas en un entorno residencial tranquilo y seguro. La vivienda destaca por su amplitud, luminosidad, excelentes calidades y dos terrazas muy amplias
",moratalaz
411.500,Piso en Avenida del Doctor García Tapia Media Legua,106,3, exterior con ascensor,/inmueble/107893888/,"
¡EXCLUSIVA DE VIVIENDA2!
DISEÑA TU HOGAR A MEDIDA EN UNA UBICACIÓN INMEJORABLE
VIVIENDA2 presenta en exclusiva esta magnífica vivienda exterior en planta baja ubicada en la reconocida Avenida del Doctor García Tapia, una arteria tranquila y bien comunicada en el consolidado barrio de Moratalaz.
Se trata de una propi
",moratalaz
419.000,Dúplex en Calle de Mario Cabré Marroquina,85,3,Bajo exterior con ascensor,/inmueble/109008324/,"
Blue Future Real Estate pone en venta en EXCLUSIVA este exclusivo producto que no dejará indiferente a nadie.
La primera imagen del anuncio refleja una RECREACIÓN VIRTUAL de cómo podría quedar la propiedad.
POSIBILIDADES DE FINANCIACIÓN A TRAVÉS DE NUESTRO DEPARTAMENTO FINANCIERO.
Vivienda TOTALMENTE REFORMADA y pa
",moratalaz
209.999,Piso en Avenida de Moratalaz Media Legua,51,2,Bajo interior con ascensor,/inmueble/109250347/,"
Si buscas una oportunidad de inversión en Madrid, este piso en Moratalaz es perfecto para ti. Actualmente alquilado desde mayo de 2022, ofrece rentabilidad desde el primer día.
- Ubicación: Situado en el consolidado barrio de Moratalaz, en una zona tranquila y bien comunicada, con comercios, colegios y transporte púb
",moratalaz
450.000,Piso en Calle de Luis de Hoyos Sainz Vinateros,96,3,Planta 7ª exterior con ascensor,/inmueble/109062479/,"
¡SOMOS PROPIETARIOS! Disfruta de todas las ventajas de comprar directamente a la propiedad.
Clikalia presenta este piso ubicado en el barrio de Vinateros, en Madrid.
La vivienda está ubicada en la 7 planta exterior con ascensor. Dispone de una superficie total de 96 m², distribuidos en salón y comedor, cocina abierta
",moratalaz
237.000,Piso en Calle de la Hacienda de Pavones Fontarrón,76,2,Planta 4ª exterior sin ascensor,/inmueble/108309551/,"
CONTACTAR CON LA EXTENSIÓN Nº 3
Piso en calle Hacienda de Pavones, en la zona de Fontarrón, perteneciente al
distrito de Moratalaz.
Edificio de 1970. Totalmente exterior. Si bien no dispone de ascensor, cuenta con el espacio adecuado que a nivel urbanístico es viable para su instalación.
ITE favorable y Certificado
",moratalaz
226.000,Estudio en Calle de la Marroquina Marroquina,Bajo,31,,/inmueble/109188881/,"
Piso de diseño a estrenar en calle Marroquina, a pocos metros del metro de Vinateros Reforma integral, alta rentabilidad e inmejorable entorno natural
Vivienda2 tiene el placer de presentar esta excelente oportunidad, ¿Buscas una vivienda lista para entrar a vivir o invertir, con calidades de lujo, diseño exclusivo y
",moratalaz
180.000,Estudio en Calle de la Marroquina Marroquina,Bajo,36,,/inmueble/108772332/,"
Extraordinario estudio PARA ENTRAR A VIVIR (o rentabilizar desde el primer día) con reforma reciente, en la calle Marroquina, junto a la Cuña Verde de Moratalaz, planta baja, exterior.
*Inmueble transformado a vivienda, a estrenar y con Licencia de Primera Ocupación aprobada por el Ayuntamiento de Madrid*
Estudio de
",moratalaz
540.000,Piso en Calle de la Tacona Fontarrón,104,5,Planta 8ª exterior con ascensor,/inmueble/108912283/,"
Housfy vende piso en Moratalaz, Madrid.
Detalles del inmueble:
-8º planta exterior con ascensor en finca de 1975.
- Admirable piso de 104 m2 + 20 m2 de espectacular terraza con amplias posibilidades en Fontarrón. (Los metros cuadrados están verificados con la Dirección General de Catastro)
- Cálido salón-comedor que
",moratalaz
270.000,Piso en Calle del Camino de los Vinateros Vinateros,75,3,Planta 4ª exterior sin ascensor,/inmueble/108969807/,"
Agencia inmobiliaria de MADRID – zona MORATALAZ – CAMINO DE LOS VINATEROS - PICO DE ARTILLEROS - CORREGIDOR DE JUAN DE BOBADILLA – TECNOCASA - VENDE - GRAN OPORTUNIDAD.
¡Oportunidad única en Moratalaz! Este encantador piso en buen estado a entrar a vivir de 75 m², ubicado en una zona mas verde y tranquila, te ofrece t
",moratalaz
575.000,Piso en Corregidor Alonso de Aguilar Media Legua,129,3,Planta 6ª exterior con ascensor,/inmueble/108841620/,"
SM HOMES Gestión Inmobiliaria presenta en exclusiva esta magnífica vivienda ubicada en el corazón de Moratalaz.
La propiedad cuenta con tres amplios y luminosos dormitorios, con posibilidad de habilitar un cuarto dormitorio. Dispone de dos baños completos, una espaciosa cocina con zona office y acceso a una terraza-la
",moratalaz
489.000,Piso en Calle de Valdebernardo Pavones,126,3,Planta 2ª exterior con ascensor,/inmueble/108731466/,"
Se vende estupendo piso muy luminoso y bien distribuido, ideal para familias. Cuenta con: 3 amplios dormitorios, 2 baños completos, Cocina independiente con tendedero, Salón-comedor con acceso a una gran terraza cerrada, perfecta como zona de estar o despacho. Trastero incluido, ideal para almacenaje, Plaza de garaje e
",moratalaz
280.000,Piso en Calle del Camino de los Vinateros Vinateros,89,3,Planta 4ª exterior sin ascensor,/inmueble/109233674/,"
Lanzamos esta vivienda el sábado 13 de Septiembre. Por las características y precio de la vivienda llevaremos el orden según entrada de la petición por el portal inmobiliario que nos haya conocido. No deje que se adelanten y pierda esta oportunidad.
Tu futuro hogar destaca en:
-Piso de 3 dormitorios ( actualmente dos
",moratalaz
279.900,Piso en Calle de Arroyo de Fontarrón Fontarrón,80,4,Planta 1ª exterior sin ascensor,/inmueble/109103668/,"
Entreplanta de, 4 dormitorios, baño y aseo en arroyo fontarron, cocina con terraza tendedero, aire acondicionado, 78 metros utiles, muy buena zona residencial, frente a la a3, a 5 minutos andando de metro pavones y artilleros, muy cerca polideportivo, centro de salud y especialidades, intercambiado de autobuses, superm
",moratalaz
249.000,Piso en Fontarrón Madrid,65,3,Planta 4ª exterior con ascensor,/inmueble/108404107/,"
Exclusivas Romero comercializa en Exclusiva vivienda en Moratalaz.
El inmueble cuenta con una superficie de 60m2 y se distribuye de la siguiente manera: Hall de entrada, cocina amueblada, salón-comedor de, pasillo distribuidor, cuarto de baño y tres dormitorios.
Vivienda exterior, con ascensor, fachada rehabilitada,
",moratalaz
212.600,Piso en Calle de Valdebernardo Pavones,91,3,Planta 10ª exterior con ascensor,/inmueble/107878636/,"
IDEAL PARA INVERSORES: VENTA DE NUDA PROPIEDAD.
NUDA PROPIEDAD. Grupo Retiro gestiona la venta de la nuda propiedad de una vivienda valorada en 374.062, 08€ euros a cambio de un Pago Único de Capital de 212.600 €. Los usufructuarios, hombre de 81 años y mujer de 76 años, continuarán utilizando el inmueble hasta su fal
",moratalaz
328.800,Piso en Calle Pico de los Artilleros Vinateros,80,3,Bajo exterior con ascensor,/inmueble/109181367/,"
Entreplanta en colonia privada familia y hogar, 80 mts. , 3 dormitorios, 1 baño completo con bañera, salon con terraza, cocina con terraza tendedero, excelente ubicacion, frente al metro artilleros linea 9, parada de de autobus, colonia privada con vigilancia 24 hs, parking exterior vigilado sin plaza fija, cuenta tamb
",moratalaz
290.000,Piso en Calle de la Cañada Vinateros,60,2,Planta 1ª exterior con ascensor,/inmueble/108597552/,"
OPORTUNIDAD DE INVERSIÓN EN EXCELENTE ZONA – SE VENDE CON INQUILINO- JUNTO AL METRO ARTILLEROS
Se vende fantástico piso de 60 m², totalmente reformado con excelentes calidades. Originalmente de tres dormitorios, actualmente cuenta con dos dormitorios, lo que ha permitido ampliar y disfrutar de un salón espacioso y muy
",moratalaz
210.000,Piso en Calle de la Encomienda de Palacios Pavones,60,3,Planta 4ª exterior sin ascensor,/inmueble/108735208/,"
*** PRECIO NO NEGOCIABLE /PRECIO NO NEGOCIABLE/PRECIO NO NEGOCIABLE/PRECIO NO NEGOCIABLE/PRECIO NO NEGOCIABLE/PRECIO NO NEGOCIABLE/PRECIO NO NEGOCIABLE ***
¡OPORTUNIDAD EN MORATALAZ! PISO DE 60 m² EXTERIOR, 3 DORMITORIOS Y TERRACITA
¿Buscas un piso con potencial en una ubicación excelente? ¡Aquí lo tienes!
Este inmue
",moratalaz
336.000,Piso en Calle de la Encomienda de Palacios Fontarrón,73,3,Planta 1ª interior con ascensor,/inmueble/108626163/,"
1º planta alta con ascensor, totalmente reformado, excelentes calidades, luminoso, 3 dormitorios, baño y aseo(ambos con ducha), cocina con terraza integrada, salon independiente, aire acondicionado, suelo de parquet, paredes lisas, doble cerramiento de aluminio con cristal climalit, en pasillos comunes vigilancia por c
",moratalaz
289.000,Piso en CL Pico Artilleros Vinateros,73,3,Planta 2ª exterior sin ascensor,/inmueble/108766425/,"
Piso con inquilinos en rentabilidad en Moratalaz, a 30 segundos del metro
Descripción:
Enamorarse de un hogar también es enamorarse de su luz…
Este piso tipo L4 en Moratalaz te ofrece eso y más.
Superficie y distribución:
– 75 m² construidos
– Exteriores, con orientación oeste: tardes doradas, cálidas y llenas de vid
",moratalaz
245.000,Piso en Calle de la Encomienda de Palacios 187,68,3,Planta 3ª exterior sin ascensor,/inmueble/109205430/,"
 Oportunidad en Moratalaz – Piso luminoso de 3 dormitorios con trastero
¿Buscas un hogar acogedor en una de las zonas más tranquilas y consolidadas de Madrid? Este piso en Moratalaz es justo lo que necesitas. Con tres amplios dormitorios, un baño completo, y trastero incluido, ofrece espacio y comodidad para toda la
",moratalaz
269.000,Piso en Calle Corregidor Juan Francisco de Luján 23,71,3,Planta 4ª exterior con ascensor,/inmueble/108934066/,"
Se vende vivienda con amplias posibilidades
* Totalmente exterior y muy luminosa lo que garantiza luz natural todo el día, tiene una superficie de 71 m2 construidos/68 m2 útiles, para actualizar con reforma. Esta situada en la 4* planta con el ascensor en ejecución y dispone de una muy buena distribución para aprovech
",moratalaz
260.000,Piso en Calle de la Encomienda de Palacios 115,83,3,Planta 2ª exterior sin ascensor,/inmueble/108776620/,"
Se vende piso muy luminoso en Moratalaz, en una zona muy tranquila, con mucho aparcameinto y zonas peatonales, ideal para descansar y disfrutar. El piso está recién pintado, cuenta con tres dormitorios, el más grande con un magnífico armario empotrado, en el pasillo podemos encontrar otro armario, baño completo con pla
",moratalaz
330.000,Piso en Avenida de Moratalaz 96,59,2,Planta 2ª exterior con ascensor,/inmueble/109069593/,"
Se presenta una vivienda reformado reciente, con 2 habitaciones amplias con camas de matrimonio cada una se han proyectado paredes exterior con espuma, ventanas motorizadas donde se pueden controlar como por pulsador táctil como por aplicación móvil, se incorpora en el pasillo trastero amplio, cuarto de baño reformado,
",moratalaz
540.000,Dúplex en Fontarrón Madrid,125,4,Planta 3ª exterior con ascensor,/inmueble/108897707/,"
DÚPLEX TOTALMENTE REFORMADO CON REFORMA A ESTRENAR, MUY SOLEADO, A 8 MIN A PIE DEL METRO ARTILLEROS, CON TRASTERO. Muy agradable y soleado, todo exterior, excelente, junto a colegios, mercado, bus, M30, piscinas municipales y Central de Policía. 125 m2, 4 dormitorios dobles con armarios empotrados, 2 baños con ventana,
",moratalaz
304.000,Piso en Calle de la Encomienda de Palacios Fontarrón,70,2,Planta 2ª exterior sin ascensor,/inmueble/109121809/,"
Encomienda de palacios, 2º planta de 70 mts. , 2 dormitorios con armarios (antes 3), salon amplio, baño completo con bañera, totalmente exterior, para entrar a vivir, muy cerca del metro artilleros linea 9, excelente ubicacion, muy buena comunicacion, trastero individual, muy cerca mercado, colegios, instituto, polidep
",moratalaz
245.000,Piso en Calle de la Encomienda de Palacios Fontarrón,81,3,Bajo exterior con ascensor,/inmueble/108924353/,"
Presentamos este estupendo bajo de 81 m² según Catastro, distribuido en 3 habitaciones amplias, baño completo con plato de ducha, y cocina independiente con tendedero integrado.
El salón dispone de una terraza cerrada y acristalada, perfecta como zona de relax, lectura o despacho.
La vivienda se sitúa en una finca co
",moratalaz
240.000,Piso en Calle de la Hacienda de Pavones 74,74,3,Planta 3ª exterior sin ascensor,/inmueble/109182371/,"
Piso en Moratalaz – Excelente Ubicación Abstenerse agencias
Se vende estupendo piso de 74 m² en una de las zonas más consolidadas de Moratalaz, listo para entrar a vivir.
La vivienda se distribuye en tres dormitorios, salón luminoso, cocina independiente, cuarto de baño completo y terraza. Además, cuenta con calefacc
",moratalaz
260.000,Piso en Anda. Doctor García Tapia 88,50,2,Planta 1ª exterior con ascensor,/inmueble/109143085/,"
Abstenerse Agencias. No contesto a ninguna. Seguro.
Tiene trastero.
",moratalaz
470.000,Piso en Media Legua Madrid,94,3,Planta 2ª exterior con ascensor,/inmueble/108549783/,"
Piso privilegiado por su inmejorable ubicación, entorno, planta, distribución, orientación y vistas. Está situado en una tranquila zona residencial de Moratalaz, frente a un parque, con vistas espectaculares en espacio abierto sin edificios cercanos que reduzcan las vistas y la intimidad.
La vivienda está en la segun
",moratalaz
630.000,Piso en Calle Laguna Negra Horcajo,167,4,Planta 5ª exterior con ascensor,/inmueble/108355601/,"
Arrenda pone en exclusiva impresionante vivienda de 4 dormitorios en urbanización privada en la zona de Horcajo, Moratalaz.
Descubre esta fantástica vivienda de 167 metros, con garaje, trastero y piscina comunitaria opcional. En perfecto estado de conservación, la vivienda es toda exterior, con increíbles vistas a par
",moratalaz
530.000,Piso en Pasaje de Villaconejos 2,119,3,Planta 1ª exterior con ascensor,/inmueble/109252419/,"
Este piso, ubicado junto al Parque de la Cuña Verde y del Parque Forestal, te ofrece un entorno natural envidiable para disfrutar de actividades al aire libre. Está en zona muy tranquila, pero a la vez con colegios, comercios y todos los servicios. Cuenta con una excelente conexión con la M30, M40 y A3, y un servicio d
",moratalaz
340.000,Piso en Calle del Corregidor Juan de Bobadilla Vinateros,83,3,Planta 2ª exterior sin ascensor,/inmueble/109227441/,"
**** Agencia inmobiliaria de MADRID - Zona ARTILLEROS - VINATEROS - CAMINO DE LOS VINATEROS - AV. MORATALAZ - ARROYO BELINCOSO - CORREGIDOR JUAN DE BOBADILLA- CLICKHAUS MORATALAZ. UBICADOS EN C/ CAMINO DE LOS VINATEROS 119 y en C/ CAMINO DE LOS VINATEROS 81****
VENDE estupendo PISO, tipología L4 TAPADERA con POSIBILID
",moratalaz
599.000,Piso en Avenida del Doctor García Tapia Horcajo,143,3,Planta 4ª exterior con ascensor,/inmueble/107818734/,"
**Piso en Venta en MORATALAZ - HORCAJO, Madrid - Oportunidad Única**     Ubicado en una urbanización privada del barrio de Horcajo (Moratalaz), este amplio y luminoso piso de 143 m² construidos (115 m² útiles) es la opción perfecta para familias que buscan calidad de vida, tranquilidad y buena comunicación con el centr
",moratalaz
245.000,Piso en Calle del Corregidor Juan Francisco de Luján Fontarrón,72,3,Planta 1ª exterior sin ascensor,/inmueble/109217032/,"
Agencia inmobiliaria de MADRID - Zona CAMINO DE LOS VINATEROS - AV. MORATALAZ - CLICKHAUS MORATALAZ. C/CAMINO DE LOS VINATEROS 119.
CLICKHAUS VENDE. PRIMERA PLANTA SIN ASCENSOR. EXCELENTE UBICACIÓN. CGDOR JUAN FRANCISCO DE LUJAN.
¡DISPONIBLE OPORTUNIDAD DE COMPRA! CLICKHAUS MORATALAZ.
Inmueble situado en una de las
",moratalaz
420.000,Piso en Calle Pico de los Artilleros Marroquina,104,3,Planta 5ª exterior con ascensor,/inmueble/109236871/,"
**** Agencia inmobiliaria de MADRID - Zona ARTILLEROS - VINATEROS - CAMINO DE LOS VINATEROS - AV. MORATALAZ - ARROYO BELINCOSO - SANCHO DE CÓRDOBA- CLICKHAUS MORATALAZ. UBICADOS EN C/ CAMINO DE LOS VINATEROS 119 y en C/ CAMINO DE LOS VINATEROS 81 ****
¡Descubre tu nuevo hogar en el corazón de Moratalaz!
Este encantado
",moratalaz
525.000,Piso en Calle del corregidor juan de bobadilla 8,85,3,Planta 1ª exterior sin ascensor,/inmueble/109245885/,"
¡OPORTUNIDAD ÚNICA EN MORATALAZ!
Venta por particular NO Inmobiliarias.
Piso de 85 m² con reforma integral realizada este año y diseñado por un estudio de interiorismo.
¿Buscas tu nuevo hogar en una de las zonas más tranquilas y verdes de Madrid? Te presentamos este espectacular piso reformado íntegramente con materi
",moratalaz
450.000,Piso en Calle Augusto González Besada Marroquina,90,3,Planta 1ª exterior con ascensor,/inmueble/109200321/,"
El equipo de ABRIL20 y toda su experiencia de vida, gestiona la venta de este piso en Marroquina, la zona más prestigiosa y demandada de Moratalaz, con 3 habitaciones y dos baños, salón comedor con terraza incorporada, cocina con ofice, persianas automáticas, toldos en todas las ventanas, plaza de garaje para residente
",moratalaz
225.500,Piso en Pavones Madrid,58,2,Planta 3ª exterior sin ascensor,/inmueble/108445620/,"
""VIVIENDA ALQUILADA, IDEAL PARA INVERSORES
Excelente piso de 2 dormitorios y 1 baño. Se encuentra en la planta 3 de un edificio residencial y cuenta con terraza.
La vivienda se distribuye en 2 dormitorios, salón-comedor, cocina independiente, equipada con muebles altos y bajos, vitrocerámica, horno y campana extrac
",moratalaz
236.500,Piso en Fontarrón Madrid,58,3,Planta 1ª exterior sin ascensor,/inmueble/108445810/,"
""VIVIENDA ALQUILADA, IDEAL PARA INVERSORES
Excelente piso de 3 dormitorios y 1 baño. Se encuentra en la planta 1 de un edificio residencial.
La vivienda se distribuye en 3 dormitorios, salón-comedor, cocina independiente, equipada con muebles altos y bajos, vitrocerámica, horno y campana extractora. Dispone de suel
",moratalaz
479.000,Piso en Calle de la Marroquina Marroquina,93,3,Planta 2ª exterior con ascensor,/inmueble/109154560/,"
**** Agencia inmobiliaria de MADRID - Zona ARTILLEROS - VINATEROS - CAMINO DE LOS VINATEROS - AV. MORATALAZ - ARROYO BELINCOSO - SANCHO DE CÓRDOBA- CLICKHAUS MORATALAZ. UBICADOS EN C/ CAMINO DE LOS VINATEROS 81 y en C/ CAMINO DE LOS VINATEROS 119****
¡Descubre tu nuevo hogar en el corazón de Moratalaz!
Este encantador
",moratalaz
232.000,Piso en CL Encomienda De Palacios Fontarrón,82,3,Planta 1ª exterior con ascensor,/inmueble/109005313/,"
INMUEBLE OKUPADO, NO SE PUEDE VISITAR. PROPIO PARA INVERSORES O VECINOS QUE CONOZCAN EL INMUEBLE.
PROPIO, PEQUEÑO Y GRAN INVERSOR.
Madrid es un municipio y una ciudad de España. La localidad, con categoría histórica de villa, es la capital del Estado y de la Comunidad de Madrid. En su término municipal, el más poblado
",moratalaz
215.000,Piso en Calle de la Encomienda de Palacios Fontarrón,81,4,Bajo exterior sin ascensor,/inmueble/109007402/,"
INMUEBLE OKUPADO, NO SE PUEDE VISITAR. PROPIO PARA INVERSORES O VECINOS QUE CONOZCAN EL INMUEBLE.
PROPIO, PEQUEÑO Y GRAN INVERSOR.
Madrid es un municipio y una ciudad de España. La localidad, con categoría histórica de villa, es la capital del Estado y de la Comunidad de Madrid. En su término municipal, el más poblado
",moratalaz
369.000,Piso en Calle de Arroyo de Fontarrón Fontarrón,89,3,Planta 4ª exterior con ascensor,/inmueble/108552905/,"
Agencia inmobiliaria de MADRID - Zona CAMINO DE LOS VINATEROS - AV. MORATALAZ- CLICKHAUS MORATALAZ. C/CAMINO DE LOS VINATEROS 119.
CLICKHAUS VENDE. TIPOLOGÍA L9. CON PLAZA DE GARAJE. CALLE DEL ARROYO FONTARRON. EXTERIOR.
¡DISPONIBLE OPORTUNIDAD DE COMPRA!
Inmueble situado en una de las mejores zonas de Moratalaz.
S
",moratalaz
250.000,Piso en Calle Entre Arroyos Media Legua,54,2,Planta 3ª exterior sin ascensor,/inmueble/107258049/,"
Espectacular PROPIEDAD PARA INVERSIÓN dividida en dos apartamentos independientes y completamente equipados.
Ambos estudios suman 54 metros cuadrados y están recientemente reformados, ideales para obtener rentabilidad.
Actualmente se encuentran alquilados.
Cada estudio cuenta con cocina y baño independientes, lavadora,
",moratalaz
369.000,Piso en Calle de Arroyo de Fontarrón Fontarrón,89,3,Planta 4ª exterior con ascensor,/inmueble/109173652/,"
Agencia inmobiliaria de MADRID - Zona CAMINO DE LOS VINATEROS - AV. MORATALAZ- CLICKHAUS MORATALAZ. C/CAMINO DE LOS VINATEROS 119.
CLICKHAUS VENDE. TIPOLOGÍA L9. CON PLAZA DE GARAJE. CALLE DEL ARROYO FONTARRON. EXTERIOR.
¡DISPONIBLE OPORTUNIDAD DE COMPRA!
Inmueble situado en una de las mejores zonas de Moratalaz.
S
",moratalaz
265.000,Piso en Calle de Lyon 15,60,1,Bajo exterior con ascensor,/inmueble/109231967/,"
CÓDIGO DE LLAMADA: 120
Acogedor loft en Horcajo, la zona más moderna de Moratalaz (el barrio más seguro de todo Madrid según datos del Consejo de Seguridad del Ayuntamiento).
Cuenta con una distribución moderna, diáfana, muy luminosa, que aporta gran sensación de amplitud y dispone de acceso totalmente independiente.
",moratalaz
698.000,Piso en Calle del Corregidor Diego de Valderrábano Media Legua,114,3,Planta 6ª exterior con ascensor,/inmueble/109028195/,"
Alquiler Protegido/ Venta Garantizada, pone a su disposición, un estupendo piso en Moratalaz de 114 m2, de los cuales son útiles 107m2. distribuidos en cocina con tendedero cerrado, 3 habitaciones, la principal con armario empotrado, dos baños uno con plato de ducha y el otro bañera y un amplio salón, el recibidor cuen
",moratalaz
475.000,Piso en Calle de la Hacienda de Pavones Vinateros,95,3,Planta 1ª exterior con ascensor,/inmueble/108308528/,"
Inmobiliaria VOhome Moratalaz vende.
Magnifica propiedad, junto a la PLAZA DEL ENCUENTRO!
Es una vivienda exterior, compuesta de 3 dormitorios, todos con armarios empotrados, dormitorio principal con pequeña terraza y baño completo en suite, amplio salón con acceso a terraza exterior, cocina, un segundo baño completo
",moratalaz
250.000,Piso en Calle del Arroyo Belincoso s/n,60,3,Bajo exterior con ascensor,/inmueble/108972650/,"
Agencia inmobiliaria de MADRID zona MARROQUINA - VINATEROS - MORATALAZ perteneciente al grupo TECNOCASA empresa líder del sector con más de 30 años de experiencia en España,
VENDE:
Estupenda vivienda en PLANTA BAJA, situada en una de las mejores zonas de Moratalaz, la Calle Arroyo Belincoso, muy próximo al Metro de V
",moratalaz
270.000,Piso en Avenida de Moratalaz Vinateros,64,2,Bajo exterior con ascensor,/inmueble/108820198/,"
Agencia inmobiliaria de MADRID – zona MORATALAZ – CAMINO DE LOS VINATEROS - PICO DE ARTILLEROS - CORREGIDOR DE JUAN DE BOBADILLA – TECNOCASA - VENDE - GRAN OPORTUNIDAD.
¡Oportunidad única en Moratalaz! Piso amplio de 64 m², ubicado en una zona verde y muy tranquila, te ofrece todo lo que necesitas para vivir cómodamen
",moratalaz
