precio,localidad,tamanio,habitaciones,descripcion,link,descripcion_larga,distrito
640.000,Piso en Calle del Alcalde Sainz de Baranda Niño Jesús,83,2,Planta 5ª exterior con ascensor,/inmueble/108705807/,"
MADRID - ZONA LA ESTRELLA - RETIRO- METRO ""SAINZ DE BARANDA"" - VIVIENDA TOTALMENTE REFORMADA A ESTRENAR - 2 HABITACIÓNES DOBLES (ANTES 3) EXCELENTE OCASION!
CARACTERÍSTICAS: 83m². Salón-comedor, cocina independiente (con cristalera al salón) equipada con electrodomésticos (vitrocerámica de inducción, campana, horno y
",retiro
689.000,Piso en Avenida de Menéndez Pelayo Pacífico,98,3,Planta 2ª interior con ascensor,/inmueble/108922628/,"
La empresa DG Real Estate, VENDE en exclusiva, este MAGNIFICO y MARAVILLOSO PISO en la zona de RETIRO, en la Avenida de Menéndez Pelayo.
INMUEBLE COMPLETAMENTE REFORMADO A ESTRENAR, REALIZADA CON UNOS MATERIALES DE ALTAS CALIDADES, DISEÑADO CON UN TOQUE MODERNO Y EXCLUSIVO.
La vivienda consta de 98 metros cuadrados d
",retiro
2.800.000,Piso en Calle de Menorca Ibiza,289,4,Planta 3ª exterior con ascensor,/inmueble/109244408/,"
Excepcional piso a estrenar de 4 habitaciones y 5 baños en el barrio de Ibiza, ubicado en una bonita finca de 1948. La vivienda está íntegramente reformada por nuestros arquitectos e interioristas con diseño, calidad y buen gusto. Lista para entrar a vivir, con todos los muebles y decoración incluidos.
¿Cómo está orga
",retiro
550.000,Piso en Calle de Ibiza Ibiza,105,4,Planta 6ª exterior con ascensor,/inmueble/109147010/,"
RedPiso Retiro ofrece en exclusiva este luminoso piso exterior en NUDA PROPIEDAD, en donde la usufructuaria tiene actualmente 65 años, ubicado en calle de Ibiza, Retiro, Madrid.
Situado en sexta planta, este inmueble combina espacio, comodidad y funcionalidad, ideal para quienes buscan una inversión segura en una zona
",retiro
450.000,Piso en Avenida de Menéndez Pelayo Pacífico,62,3,Planta 3ª interior con ascensor,/inmueble/109246415/,"
GALOTA INVERSIÓN E INMOBILIARIA VENDE PISO REFORMADO
¿Buscas un hogar listo para entrar a vivir? Este luminoso piso recién reformado combina comodidad, estilo y una ubicación ideal para disfrutar de la vida en Madrid.
Comunícate con nosotros escribiendo al WhatsApp 604_89_3314
Distribución:
3 habitaciones dobles
",retiro
2.700.000,Dúplex en Jerónimos Madrid,240,2,Bajo exterior con ascensor,/inmueble/107432798/,"
Espectacular dúplex reformado y amueblado en el centro del barrio de Los Jerónimos. Uno de los mejores edificios que fue completamente rehabilitado en 2020 y en el que se ha mantenido la fachada clásica, el patío central y la entrada de gran valor histórico. Situado junto a la entrada del parque del Retiro. La vivienda
",retiro
785.000,Piso en Calle de los Astros Estrella,100,3,Planta 11ª exterior con ascensor,/inmueble/107526432/,"
¡SOMOS PROPIETARIOS! Disfruta de todas las ventajas de comprar directamente a la propiedad.
Clikalia presenta este piso ubicado en el barrio de Estrella, en Madrid.
La vivienda está ubicada en la 11 planta exterior con ascensor. Dispone de una superficie total de 100 m², distribuidos en salón y comedor, cocina indepe
",retiro
630.000,Piso en Calle del Comercio Pacífico,106,2,Planta 1ª exterior con ascensor,/inmueble/108537590/,"
Amplio y acogedor piso exterior en Pacífico
Engel & Völkers presenta este estupendo piso ubicado en una primera planta con orientación sur, que ofrece una excelente luminosidad natural durante todo el día. La vivienda se encuentra en perfecto estado, lista para entrar a vivir sin necesidad de reformas.
Cuenta con dos
",retiro
3.100.000,Piso en Calle de Casado del Alisal Jerónimos,231,3,Planta 4ª exterior con ascensor,/inmueble/108614575/,"
Propiedad reformada en Jerónimos con garaje y trastero
Engel & Völkers presenta esta magnífica propiedad recién reformada en finca moderna, situada a tan solo unos pasos del emblemático Parque del Retiro. Esta excepcional vivienda destaca por su extraordinaria luminosidad natural, que baña cada espacio creando un ambie
",retiro
9.500.000,Dúplex en Calle de Alfonso XII Jerónimos,805,4,Planta 2ª exterior con ascensor,/inmueble/108307882/,"
Espectacular vivienda con vistas al Retiro
Ubicado en una de las zonas más exclusivas y cotizadas de Madrid, este imponente palacete de 1910 combina el encanto de la historia con las más altas calidades contemporáneas. Completamente reformado en 2019 y actualizado en 2024, se presenta como una propiedad única e irrepet
",retiro
2.650.000,Piso en Jerónimos Madrid,180,3,Planta 1ª exterior con ascensor,/inmueble/93478674/,"
Magnifico piso exterior, situado en una de las mejores zonas del retiro-Jerónimos. Buena finca, con portero físico y ascensor. Piso muy luminoso, con tres balcones a calle principal, cocina integrada al salón, aire acondicionado, dormitorios con baño y armarios empotrados. Zona céntrica, bien comunicada, dotada de todo
",retiro
845.000,Piso en Paseo de la Reina Cristina Jerónimos,157,4,Planta 2ª exterior con ascensor,/inmueble/108004066/,"
***¡ESTUPENDO PISO CON TERRAZA JUNTO AL RETIRO PARA CONVERTIR EN EL HOGAR PERFECTO! ***
A 3 minutos andando de la Puerta Mariano de Cavia que da acceso al Parque del Retiro, esta amplia vivienda muy tranquila y soleada en buen finca con portero es ideal para vivir.
Cuenta con dos entradas, principal y de servicio, y
",retiro
730.000,Piso en Paseo de la Infanta Isabel Jerónimos,107,2,Planta 1ª exterior con ascensor,/inmueble/107190796/,"
Descubre este encantador apartamento en el prestigioso barrio de Jerónimos, Retiro, Madrid. Con 107 m², esta propiedad ofrece un espacio ideal para disfrutar de la vida urbana. El apartamento está en proceso de reforma, asegurando un diseño moderno y funcional. Cuenta con 2 dormitorios y 2 baños, además de un balcón pe
",retiro
870.000,Ático en Calle de Cavanilles Pacífico,117,3,Planta 7ª exterior con ascensor,/inmueble/108557916/,"
¡SOMOS PROPIETARIOS! Disfruta de todas las ventajas de comprar directamente a la propiedad.
Clikalia presenta este ático ubicado en el barrio de Pacífico, en Madrid.
La vivienda está ubicada en la 7 planta exterior con ascensor. Dispone de una superficie total de 117 m², distribuidos en salón y comedor, cocina indepe
",retiro
855.000,Piso en Pacífico Madrid,153,3,Planta 3ª exterior con ascensor,/inmueble/108777652/,"
Excelente oportunidad a pasos del Retiro
Bienvenido a un excelente apartamento a reformar en el barrio de Retiro. Este espacioso hogar, construido en 1970, cuenta con tres habitaciones y dos baños, proporcionando un lienzo perfecto para aquellos que buscan crear un refugio de lujo en una de las zonas mas priviligiedas
",retiro
