precio;localidad;tamanio;habitaciones;descripcion;link;descripcion_larga;distrito
299.900;Piso en Casco Antiguo Leganés;81;3;Planta 2ª interior con ascensor;/inmueble/109155206/;"
HOGARES LEGANÉS
VENDE EN EXCLUSIVA
OPORTUNIDAD!
Maravilloso piso reformado en la mejor zona de Leganés, se compone de;
Hall de entrada, tres dormitorios amplios, dos baños con plato de ducha y mampara; un GRAN SALÓN con salida a terraza abierta; cocina amplia muy luminosa con salida a tendedero.
Cuenta con suelo d
";leganes-madrid
365.000;Piso en Av Portugal El Carrascal;102;3;Planta 1ª exterior con ascensor;/inmueble/108946056/;"
**Piso en Venta en Ubicación Privilegiada - ¡Tu Nuevo Hogar Te Espera! **
Descubre este espectacular piso exterior situado en la primera planta con ascensor. Con 102 m² de construcción, este hogar ofrece una luminosidad excepcional gracias a su orientación norte-sur, que permite disfrutar de luz natural durante todo e
";leganes-madrid
235.000;Piso en Santos Leganés;73;2;Planta 2ª exterior con ascensor;/inmueble/108467798/;"
MISTERPISO VENDE EXCELENTE PISO EN LEGANES.
A 5 minutos de la universidad!
Acogedora vivienda en segunda planta con ascensor, la vivienda cuenta con dos habitaciones amplias, ( antes 3) un baño completo con plato de ducha y ventana, cocina amueblada con tendedero, este se ha utilizado también para parte de la cocina y
";leganes-madrid
288.900;Piso en Calle del Ampurdán Zarzaquemada;79;3;Planta 4ª exterior con ascensor;/inmueble/108880468/;"
HOGARES LEGANÉS pone a la venta en exclusiva este luminoso piso en una cuarta planta de siete pisos en el bloque, con excelentes vistas, ubicado en el barrio consolidado de Zarzaquemada (Leganés).
La vivienda destaca por su luz natural, su buen estado de conservación y una distribución cómoda y funcional.
Cuenta con
";leganes-madrid
122.000;Piso en Calle de la Bureba Zarzaquemada;40;2;Bajo exterior con ascensor;/inmueble/104778245/;"
HOGARES LEGANÉS pone a la venta en exclusiva este FANTÁSTICO LOCAL EXTERIOR de 2 dormitorios REFORMADO.
Local de 40 M2 para realizar el cambio de uso. Cuenta con 2 habitaciones, un cuarto de baño y cocina abierta al salón. Destacar la luminosidad durante todo el día gracias a su disposición completamente exterior.
Si
";leganes-madrid
589.990;Chalet adosado en Calle de Aveiro La Fortuna;245;3;;/inmueble/108191973/;"
HOGARES LEGANÉS pone a la venta en exclusiva este espectacular Chalet Adosado de Cuatro Plantas con Terraza y Buhardilla.
Amplio y luminoso chalet adosado de 245 m² distribuidos en cuatro plantas, ideal para familias que buscan confort y amplitud. La vivienda cuenta con tres dormitorios con armarios empotrados, dos ba
";leganes-madrid
186.000;Piso en Batallas Leganés;61;2;Bajo exterior con ascensor;/inmueble/109149410/;"
Piso en en planta baja!
Este luminoso inmueble cuenta con 2 dormitorios exteriores (antes 3 dormitorios), 1 baño amplio con plato de ducha y mampara, cocina amueblada con con office ideal para los amantes de comer en la cocina.
Suelos de tarima, calefacción por calor azul, puertas en roble, ventanas doble en alumini
";leganes-madrid
425.000;Piso en Plaza Salvador Casco Antiguo;178;4;Planta 3ª exterior con ascensor;/inmueble/107801953/;"
LÍNEA 12 PROYECTOS INMOBILIARIOS VENDE:
GRAN VIVIENDA en planta tercera con ascensor y TRASTERO en pleno casco antiguo de Leganés en zona de tránsito rodado solo para residentes.
La vivienda se distribuye en hall de entrada, cocina, despensa, salón, cuatro dormitorios (Uno de ellos en suite) y vestidor, dos cuartos d
";leganes-madrid
184.900;Piso en Batallas Leganés;64;2;Bajo exterior con ascensor;/inmueble/108910521/;"
HOGARES CENTRO
VENDE EN EXCLUSIVA MARAVILLOSO PISO EN LEGANÉS
La vivienda consta de; Hall de entrada, una increíble cocina totalmente equipada, 2 habitaciones de las cuales, una habitación individual con armario empotrado y una habitación principal, un salón con muy buena iluminación, un baño muy cómodo y espacioso.
";leganes-madrid
355.000;Piso en Carrascal El Carrascal;106;3;Planta 7ª exterior con ascensor;/inmueble/109420992/;"
HOGARES LEGANÉS pone a la venta en exclusiva esta fantástica vivienda situada en una séptima planta de un edificio con ascensor en la localidad de Leganés, con una superficie construida de 106 m².
Esta propiedad destaca por su excelente estado de conservación, ya que ha sido reformada recientemente, lo que la conviert
";leganes-madrid
365.000;Piso en San Nicasio Leganés;113;3;Bajo exterior con ascensor;/inmueble/108220091/;"
**Piso en Venta en el Barrio de San Nicasio, Leganés**
Descubre este amplio y luminoso piso en el corazón del Barrio de San Nicasio, Leganés. Con una excelente ubicación, a tan solo 5 minutos de la estación de Leganés Central (Metro y Renfe), este hogar es ideal para quienes buscan comodidad y accesibilidad. El inmueb
";leganes-madrid
295.000;Piso en Casco Antiguo Leganés;98;3;Planta 3ª exterior sin ascensor;/inmueble/108424293/;"
Piso junto a la Iglesia del Salvador!
Te presentamos esta espaciosa vivienda perfectamente situada en el casco histórico de Leganés, junto a una de las arterias principales de la ciudad.
¡Es más que un hogar, es una mejora de estilo de vida en una de las zonas más vibrantes y conectadas a Madrid!
Consta de 3 habitac
";leganes-madrid
360.000;Piso en Casco Antiguo Leganés;101;3;Planta 2ª exterior con ascensor;/inmueble/108846227/;"
¡Oportunidad única en el corazón de Leganés!
Este amplio piso de 101m² Construidos, se encuentra en el encantador casco antiguo, a un paso de la Universidad Carlos III y rodeado de todas las comodidades que ofrece una zona céntrica y tranquila.
A pocos minutos de Plaza España y Plaza Fuente Honda, y con excelente co
";leganes-madrid
620.000;Dúplex en Calle Amsterdam Solagua;179;4;Planta 4ª exterior con ascensor;/inmueble/108086725/;"
ÚNICO EN SOLAGUA: ÁTICO DÚPLEX CON TERRAZA DE 44 m², 2 PLAZAS DE GARAJE Y CONSERJE
Te presentamos una vivienda exclusiva en una de las zonas más demandadas de Leganés: un ático dúplex con dos plantas, amplio, luminoso y pensado para disfrutar tanto en familia como para quienes buscan un hogar cómodo donde teletrabaja
";leganes-madrid
179.900;Piso en Batallas Leganés;67;3;Bajo exterior con ascensor;/inmueble/109420242/;"
HOGARES LEGANES CENTRO
VENDE EN EXCLUSIVA MARAVILLOSO PISO EN EL CENTRO DE LEGANÉS
Descubre este encantador piso de 65m², ideal para disfrutar de la vida en familia. Al entrar, te recibe un hall de entrada. El piso cuenta con un amplio salón lleno de luz natural, perfecto para relajarse o recibir visitas. La cocina,
";leganes-madrid
289.900;Piso en Calle del Priorato Zarzaquemada;81;3;Planta 4ª exterior con ascensor;/inmueble/109418169/;"
URBAN VENDE! Descubre tu nuevo hogar en este luminoso piso exterior totalmente reformado! Ubicado a menos de 200 metros de la estación de tren Zarzaquemada, este silencioso inmueble ofrece la combinación perfecta de comodidad y tranquilidad, con 81 m².
La vivienda cuenta con un amplio salón, con un despacho contiguo,
";leganes-madrid
390.000;Piso en Campo de Tiro Leganés;151;4;Planta 1ª exterior con ascensor;/inmueble/109325677/;"
 Vivienda en exclusiva en Leganés – Zona Campo de Tiro
URBAMAR pone a la venta, en exclusiva, una fantástica vivienda ubicada en la zona Campo de Tiro de Leganés, a solo 1 minuto andando del Metro San Nicasio.
La vivienda se distribuye en:
4 amplios dormitorios con armarios empotrados.
Luminoso salón-comedor indep
";leganes-madrid
284.823;Piso en Calle Santa Lucia 6;70;2;Bajo exterior con ascensor;/inmueble/107008793/;"
Descubre Residencial Santa Lucía, un exclusivo desarrollo en la zona de La Fortuna, Leganés, que te ofrece la oportunidad de vivir en un entorno privilegiado.
Este proyecto consta de 8 viviendas de 1, 2 y 3 dormitorios, perfectas para adaptarse a diferentes necesidades familiares.
Características principales:
6 viv
";leganes-madrid
328.660;Dúplex en Calle Santa Lucia 6;65;2;Planta 2ª exterior con ascensor;/inmueble/107008924/;"
Descubre Residencial Santa Lucía, un exclusivo desarrollo en la zona de La Fortuna, Leganés, que te ofrece la oportunidad de vivir en un entorno privilegiado.
Este proyecto consta de 8 viviendas de 1, 2 y 3 dormitorios, perfectas para adaptarse a diferentes necesidades familiares.
Características principales:
6 viv
";leganes-madrid
179.900;Piso en Calle Río Tajo San Nicasio;74;3;Planta 1ª exterior con ascensor;/inmueble/109155792/;"
¡HOGARES LEGANES SAN NICASIO VENDE!
Fantástica PRIMERA planta en el barrio de San Nicasio. A tan solo 4 minutos del Metro San Nicasio y a 7 minutos de Renfe Leganés Central.
Con una superficie de 74m2, esta vivienda cuenta con un hall de entrada, un amplio salón comedor, una cocina, tres dormitorios, un baño y terraz
";leganes-madrid
229.900;Piso en Avenida Doctor Mendiguchía Carriche San Nicasio;80;2;Planta 1ª exterior sin ascensor;/inmueble/109393408/;"
¡HOGARES LEGANES SAN NICASIO VENDE!
PRIMERA PLANTA COMPLETAMENTE REFORMADA en el barrio de San Nicasio. A tan solo 3 minutos del Metro San Nicasio y a 7 minutos de Renfe Leganés Central.
Con una superficie de 80m2, esta vivienda cuenta con un hall de entrada, un amplio salón comedor, dos dormitorios (antes de la refo
";leganes-madrid
220.000;Piso en Casco Antiguo Leganés;60;2;Bajo interior con ascensor;/inmueble/109368070/;"
¡Increíble oportunidad de adquirir un acogedor piso en el corazón de Leganés!
Este luminoso inmueble cuenta con 2 dormitorios, un baño completo y una cocina totalmente equipada con electrodomésticos.
Con una excelente ubicación cerca de transporte público, zonas comerciales, universidades, restaurantes, hospitales
";leganes-madrid
177.000;Piso en Calle Río Manzanares San Nicasio;70;3;Bajo exterior sin ascensor;/inmueble/109213421/;"
INMOBILIARIA EN SAN NICASIO - TECNOCASA ESTUDIO RÍO DUERO S. L
¡PLANTA BAJA, EN SAN NICASIO! Esta situado en muy buena zona, cerca de Metrosur San Nicasio, Renfe Leganés-Central, universidad Carlos III y centro de Leganés.
El piso consta de entrada, salón, cocina, baño y 3 dormitorios.
Está situado en muy buena zona
";leganes-madrid
183.000;Piso en San Nicasio Leganés;57;2;Planta 4ª exterior con ascensor;/inmueble/109063043/;"
Identificación del inmueble: ID0379
Se vende este acogedor piso en ultima planta con ascensor, ubicado en una zona céntrica con todos los servicios a tu alcance, junto a la Universidad Carlos III y a tan solo 350 metros de Santa Rosa-Estación Leganés Central.
La vivienda cuenta con una distribución funcional y luminos
";leganes-madrid
199.900;Piso en Calle Río Tajo San Nicasio;72;3;Planta 3ª exterior sin ascensor;/inmueble/108888789/;"
¡HOGARES LEGANES SAN NICASIO VENDE!
TERCERA planta con PLAZA DE GARAJE en el barrio de San Nicasio. A tan solo 5 minutos del Metro San Nicasio y a 7 minutos de Renfe Leganés Central.
Con una superficie de 72m2, esta vivienda cuenta con un hall de entrada, un amplio salón comedor, una cocina, tres dormitorios, un bañ
";leganes-madrid
274.900;Piso en Calle del Ampurdán Zarzaquemada;69;2;Planta 3ª exterior con ascensor;/inmueble/109305067/;"
HOGARES LEGANÉS pone a la venta en exclusiva este luminoso piso en una tercera planta de diez pisos en el bloque, con excelentes vistas, ubicado en el barrio consolidado de Zarzaquemada (Leganés).
La vivienda destaca por su luz natural, su buen estado de conservación y una distribución cómoda y funcional.
Cuenta con
";leganes-madrid
180.000;Piso en carmen La Fortuna;72;3;Planta 1ª exterior sin ascensor;/inmueble/109191653/;"
HOGARES LEGANÉS LA FORTUNA pone a la venta en exclusiva este estupendo piso exterior de 72 m², en muy buen estado y listo para entrar a vivir, ubicado en el barrio de La Fortuna, una zona tranquila y familiar de Leganés.
La vivienda ofrece una distribución cómoda y funcional, dispone de tres dormitorios amplios y lumi
";leganes-madrid
365.000;Piso en Avenida de Francia El Carrascal;111;4;Planta 1ª exterior con ascensor;/inmueble/107600380/;"
HOGARES LEGANÉS pone a la venta en exclusiva esta FANTÁSTICA VIVIENDA en una de las mejores zonas del barrio de El Carrascal. Ubicado en una primera planta, considerada 2ª.
La vivienda de 111 M2 dispone de un hall recibidor, que distribuye a todas las estancias de la vivienda.
Su salón independiente con doble ventana
";leganes-madrid
199.900;Piso en Calle Rio Duero San Nicasio;77;3;Planta 4ª exterior sin ascensor;/inmueble/109269546/;"
¡HOGARES LEGANES SAN NICASIO VENDE!
4ºPlanta en el barrio de San Nicasio. A tan solo 3 minutos del Metro San Nicasio y a 5 minutos de Renfe Leganés Central.
Con una superficie de 77m2, esta vivienda cuenta con un hall de entrada, un salón comedor, tres dormitorios, un baño y cocina con tendedero
La zona cuenta con s
";leganes-madrid
239.900;Piso en Calle del Priorato Zarzaquemada;79;3;Planta 9ª exterior con ascensor;/inmueble/101057814/;"
HOGARES MONEGROS pone a la venta en exclusiva este luminoso piso de 3 dormitorios.
Próximo a toda clase de servicios y comercios; parada de autobús, estación de RENFE de Zarzaquemada, colegios, bares, restaurantes y con una situación inmejorable tanto de acceso como de salida de Leganés.
La vivienda de 79 M2 Construid
";leganes-madrid
239.900;Piso en Calle del Priorato Zarzaquemada;79;3;Planta 9ª exterior con ascensor;/inmueble/101057814/;"
HOGARES MONEGROS pone a la venta en exclusiva este luminoso piso de 3 dormitorios.
Próximo a toda clase de servicios y comercios; parada de autobús, estación de RENFE de Zarzaquemada, colegios, bares, restaurantes y con una situación inmejorable tanto de acceso como de salida de Leganés.
La vivienda de 79 M2 Construid
";leganes-madrid
196.000;Piso en Calle de Hernán Cortés Descubridores-Escritores;67;3;Bajo exterior sin ascensor;/inmueble/108970099/;"
HOGARES LEGANÉS pone a la venta en exclusiva este acogedor piso de 65 m²en planta baja, ubicado en el centro de Leganés, en buen estado de conservación y listo para entrar a vivir.
La vivienda cuenta con tres dormitorios, un baño completo, salón con buena iluminación natural y cocina independiente.
El dormitorio pr
";leganes-madrid
365.000;Piso en Avenida de Francia El Carrascal;111;4;Planta 1ª exterior con ascensor;/inmueble/107600380/;"
HOGARES LEGANÉS pone a la venta en exclusiva esta FANTÁSTICA VIVIENDA en una de las mejores zonas del barrio de El Carrascal. Ubicado en una primera planta, considerada 2ª.
La vivienda de 111 M2 dispone de un hall recibidor, que distribuye a todas las estancias de la vivienda.
Su salón independiente con doble ventana
";leganes-madrid
199.900;Piso en Calle Rio Duero San Nicasio;77;3;Planta 4ª exterior sin ascensor;/inmueble/109269546/;"
¡HOGARES LEGANES SAN NICASIO VENDE!
4ºPlanta en el barrio de San Nicasio. A tan solo 3 minutos del Metro San Nicasio y a 5 minutos de Renfe Leganés Central.
Con una superficie de 77m2, esta vivienda cuenta con un hall de entrada, un salón comedor, tres dormitorios, un baño y cocina con tendedero
La zona cuenta con s
";leganes-madrid
279.900;Piso en Calle del Alcalde Saturnino del Yerro Alonso Valdepelayo-Montepinos-Arroyo Culebro;106;2;Planta 2ª exterior con ascensor;/inmueble/109104134/;"
HOGARES LEGANÉS SAN NICASIO VENDE!
Piso en venta en el barrio Arroyo Culebro de Leganés. Esta vivienda se encuentra en la segunda planta de un edificio con ascensor y cuenta con una superficie construida de 122m2. Forma parte de una urbanización con zonas comunes en recinto cerrado.
La distribución del piso incluye u
";leganes-madrid
499.000;Piso en Calle Jaén Las Dehesillas-Vereda de los Estudiantes;148;3;Planta 4ª exterior con ascensor;/inmueble/108890032/;"
Vivienda moderna y exclusiva en urbanización premium de Leganés
Te presentamos esta espectacular vivienda ubicada en una de las urbanizaciones más exclusivas y recientes de Leganés, construida en 2008 y equipada con todos los servicios que puedas imaginar: piscina, amplias zonas ajardinadas, espacios comunitarios cuid
";leganes-madrid
249.000;Piso en Avenida de la Libertad La Fortuna;67;3;Planta 2ª exterior sin ascensor;/inmueble/108806955/;"
HOGARES LEGANÉS LA FORTUNA pone a la venta en exclusiva este espectacular piso, de maravillosas calidades y a escasos minutos del metro LA FORTUNA, TOTALMENTE REFORMADO y con acceso inmediato a todos los servicios y las principales carreteras de la comunidad.
Esta vivienda, de 67 m² construidos, cuenta con 3 dormitori
";leganes-madrid
190.000;Piso en Callejón Ordóñez Casco Antiguo;50;1;Planta 3ª interior sin ascensor;/inmueble/108902307/;"
HOGARES LEGANÉS pone a la venta en exclusiva este precioso piso totalmente reformado en una de las mejores zonas de Leganés Centro.
Te presentamos esta fantástica vivienda de 50 m² construidos, ubicada en una tercera planta sin ascensor, completamente reformada con estilo moderno y funcional.
Originalmente de dos dor
";leganes-madrid
420.000;Piso en El Carrascal El Carrascal;128;4;Planta 1ª exterior con ascensor;/inmueble/108821146/;"
Agencia inmobiliaria de Leganés zona El Carrascal Tecnocasa Estudio Ciudad De Leganes VENDE piso de 128 m2 distribuido en salón independiente, cocina con tendedero, cuatro dormitorios, dos baños, terraza en primera planta muy luminosa con orientación sureste y 7 minutos de metro L12 'El Carrascal' y a escasos 5 min. C.
";leganes-madrid
190.000;Piso en Calle de San Vicente Santos;72;3;Planta 2ª exterior sin ascensor;/inmueble/108896042/;"
HOGARES LEGANÉS pone a la venta en exclusiva este estupendo piso de 72 m², ubicado en una zona tranquila y bien comunicada de Leganés.
La vivienda cuenta con tres habitaciones bien distribuidas y con buena entrada de luz natural, ideales para adaptarlas como dormitorios, despacho o espacio de estudio. El baño tiene
";leganes-madrid
244.900;Piso en Calle de los Pedroches Zarzaquemada;69;3;Planta 8ª exterior con ascensor;/inmueble/108189563/;"
HOGARES LEGANÉS pone a la venta en exclusiva este espectacular piso Piso en venta en Leganés de 69 m², 3 habitaciones, con ascensor.
Se vende acogedor piso de 69 m² en buen estado, ubicado en una zona tranquila y bien comunicada de Leganés. La vivienda cuenta con tres habitaciones, ideales para familias, teletrabajo o
";leganes-madrid
352.500;Piso en Calle Polonia El Carrascal;113;4;Planta 1ª exterior con ascensor;/inmueble/108470575/;"
HOGARES LEGANÉS pone a la venta en exclusiva esta FANTÁSTICA VIVIENDA en una de las mejores zonas del barrio de El Carrascal. Ubicado en una primera planta, considerada 2ª.
La vivienda de 113 M2 dispone de un hall recibidor, que distribuye la vivienda a salón y cocina.
Su salón independiente con doble ventana que abr
";leganes-madrid
175.000;Piso en Calle de Santa Teresa de Jesús La Fortuna;56;2;Planta 1ª exterior sin ascensor;/inmueble/108818974/;"
HOGARES LEGANÉS pone a la venta en exclusiva este espectacular piso exterior con terraza en La Fortuna – ¡Para reformar a tu gusto!
Se vende piso exterior de 56 m² en La Fortuna (Leganés), ubicado en una primera planta sin ascensor. La vivienda cuenta con una distribución práctica y ofrece grandes posibilidades de ref
";leganes-madrid
409.990;Piso en Avenida del Doctor Mendiguchla Carriche San Nicasio;182;4;Planta 1ª exterior con ascensor;/inmueble/109338207/;"
INMOBILIARIA EN SAN NICASIO - TECNOCASA ESTUDIO RÍO DUERO S. L
PISO EN SAN NICASIO DE 4 DORMITORIOS Y 2 BAÑOS CON 58 M2 DE TERRAZA, TRASTERO Y SOLARIUM 23 M2.
La vivienda es muy amplia, con entrada, salón independiente de 24 m2, cocina de 14 m2, cocina2, 4 dormitorios (dormitorio principal muy amplio de 16 m2), 2 baños
";leganes-madrid
142.000;Estudio en Calle Río Manzanares San Nicasio;Bajo;42;;/inmueble/109326255/;"
INMOBILIARIA EN SAN NICASIO - TECNOCASA ESTUDIO RÍO DUERO S. L
Estudio totalmente reformado muy cerca de la universidad, centro de Leganés, Renfe Leganés-Central y Metrosur San Nicasio.
DISSPONE DE:
- Cocina americana amueblada
- Suelos de tarima
- puertas de roble
- Baño con ventana y plato de ducha
- Puerta blindad
";leganes-madrid
199.900;Piso en Santos Leganés;80;3;Planta 3ª exterior sin ascensor;/inmueble/108626908/;"
PISO CON EXCELENTES VISTAS!
A veces, los lugares con más potencial son aquellos que aún guardan historias por escribir. Esta vivienda en la zona de Los Santos te espera con unas vistas despejadas a zonas verdes que enamoran nada más abrir las ventanas.
Consta de 80? m² construidos y es el lienzo perfecto para quiene
";leganes-madrid
349.000;Piso en Vírgenes Leganés;113;3;Planta 1ª exterior sin ascensor;/inmueble/108923523/;"
Espacio, luz, comodidad y una ubicación inmejorable
Si buscas algo más que una vivienda, esto es para ti. Situada en una de las zonas más cómodas de Leganés, junto a la estación de Cercanías Renfe y Metro Línea 12, esta propiedad reúne todo lo que marca la diferencia: ubicación, amplitud y un plus de confort que no en
";leganes-madrid
229.000;Piso en Casco Antiguo Leganés;71;3;Planta 1ª exterior con ascensor;/inmueble/108522509/;"
¡Oportunidad para reformar a tu gusto en pleno casco antiguo de Leganés!
Presentamos esta vivienda con un gran potencial situada en una primera planta con ascensor, en una finca con portal recientemente reformado, lo que garantiza una excelente accesibilidad, cuidada y una entrada moderna.
La vivienda cuenta con tres
";leganes-madrid
350.000;Piso en CL Panama Solagua;97;3;Planta 1ª exterior con ascensor;/inmueble/108983485/;"
CAPITAL HOME vende en EXCLUSIVA este espectacular piso en el barrio de SOLAGUA.
¡Descubre tu nuevo hogar en esta idílica urbanización privada! Este espectacular piso de 97 m² se encuentra rodeado de amplias zonas verdes, ofreciendo un entorno perfecto para disfrutar de la naturaleza sin renunciar a la comodidad de te
";leganes-madrid
170.000;Piso en Calle Rio Guadalquivir San Nicasio;70;3;Planta 3ª exterior sin ascensor;/inmueble/108849993/;"
¡HOGARES LEGANES SAN NICASIO VENDE!
TERCERA planta REFORMADA en el barrio de San Nicasio. A tan solo 5 minutos del Metro San Nicasio y a 7 minutos de Renfe Leganés Central.
Con una superficie de 70m2, esta vivienda cuenta con un hall de entrada, un amplio salón comedor, una cocina, tres dormitorios, un baño y terraz
";leganes-madrid
140.000;Estudio en Calle Río Miño San Nicasio;Bajo;30;;/inmueble/108855819/;"
Estudio - Vivienda Exterior completamente reformada de 30m2, sita en calle Rio Miño con acceso y salida directa e independiente.
La vivienda que es exterior dispone de una distribución completamente diáfana, cuenta con cocina americana totalmente equipada con lavavajillas, extractor, vitrocerámica, lavadora y nevera.
";leganes-madrid
595.000;Chalet adosado en Valdepelayo-Montepinos-Arroyo Culebro Leganés;254;4;;/inmueble/109287719/;"
CHALET EN VENTA CON PISCINA COMUNITARIA!
Descubra la oportunidad de vivir en una de las zonas residenciales más tranquilas de Leganés. Este magnífico chalet adosado de cuatro plantas combina amplitud, luminosidad y un excelente estado de conservación, ideal para familias que buscan comodidad y un entorno privilegiado.
";leganes-madrid
499.000;Piso en Avenida de Fuenlabrada Casco Antiguo;215;6;Planta 1ª exterior sin ascensor;/inmueble/108804633/;"
LÍNEA 12 PROYECTOS INMOBILIARIOS VENDE:
Piso amplio en planta PRIMERA en el centro de Leganés. Cuenta con 6 habitaciones, un luminoso salón con terraza, cocina y dos baños.
Vivienda con zonas verdes y servicios cercanos. Muy cerca de UNIVERSIDAD, del Hospital Severo Ochoa de Leganés, del centro de salud Santa Isabel
";leganes-madrid
195.000;Piso en Avenida de la Universidad Casco Antiguo;86;3;Planta 4ª exterior sin ascensor;/inmueble/108804543/;"
LÍNEA 12 PROYECTOS INMOBILIARIOS VENDE:
Piso amplio en planta cuarta en el centro de Leganés. Cuenta con 3 habitaciones, un luminoso salón con terraza, cocina y un baño.
Vivienda con zonas verdes y servicios cercanos. Muy cerca de UNIVERSIDAD, del Hospital Severo Ochoa de Leganés, del centro de salud Santa Isabel y f
";leganes-madrid
159.500;Piso en Avenida Rey Juan Carlos I El Carrascal;139;4;Planta 7ª exterior con ascensor;/inmueble/106090916/;"
IDEAL PARA INVERSORES: VENTA DE NUDA PROPIEDAD.
Grupo Retiro gestiona la venta de la nuda propiedad de una vivienda valorada en 370.000 euros a cambio de un Pago Único de Capital de 159.500 €. Los usufructuarios, hombre de 71 años y mujer de 68 años, continuarán utilizando el inmueble hasta su fallecimiento.
DESCRIPC
";leganes-madrid
193.000;Piso en Descubridores-Escritores Leganés;68;2;Bajo exterior con ascensor;/inmueble/108999895/;"
LÍNEA 12 PROYECTOS INMOBILIARIOS VENDE:
Piso en planta baja en el barrio Descubridores-Escritores de Leganés, en la ermita de San Cristobal.
Cómodo inmueble sin barreras arquitectónicas, ideal para personas con movilidad reducida. Este piso cuenta con dos amplias habitaciones (anteriormente tres ), una de las cuales
";leganes-madrid
190.000;Piso en Calle Rio Guadalquivir San Nicasio;75;3;Planta 1ª exterior sin ascensor;/inmueble/109250299/;"
INMOBILIARIA EN SAN NICASIO - TECNOCASA ESTUDIO RÍO DUERO S. L
PRIMERA PLANTA DE 3 DORMITORIOS CON TERRAZA EN SAN NICASIO. EXCELENTE UBICACIÓN.  
EL PISO SE ENCUENTRA EN BUEN ESTADO CON:
- Cocina amueblada  y Baño con plato de ducha 
- Ventanas de aluminio y puertas sapeli
- Calefacción individual de gas natural y Sp
";leganes-madrid
