precio;localidad;tamanio;habitaciones;descripcion;link;descripcion_larga;distrito
385.000;Piso en Av/Fuenlabrada 66;112;3;Planta 1ª exterior sin ascensor;/inmueble/97422217/;"
cocina y baño reformado hace 10 años cuadro de luz separado por zonas, ventanas puestas hace 10 años son oscilovatientes y apertura total, con mosquiteras son nuevas puerta de la terraza nueva con mosquitera caldera tiene un año, con vestidor, armarios empotrados, nuevas mejoras mosquiteros y puerta del patio de climal
";leganes-madrid
210.000;Piso en Calle Arquímedes Valdepelayo-Montepinos-Arroyo Culebro;92;2;Planta 1ª exterior con ascensor;/inmueble/109352927/;"
LOFT de diseño en edificio moderno con todos los servicios. Plaza muy grande de garaje incluida en el precio.
La superficie es de 86 metros útiles, repartidos en 2 plantas diáfanas de 50 metros y 36 metros respectivamente. El baño es completo con plato de ducha y cuenta con cocina americana. A/A frío/calor (3 splits).
";leganes-madrid
300.000;Piso en Avenida de Europa 61;84;3;Planta 9ª exterior con ascensor;/inmueble/108791362/;"
Este precioso piso de 84 m² combina estilo moderno con comodidad. Cuenta con 3 habitaciones amplias, 1 baños, salón-comedor muy luminoso y una cocina equipada con electrodomésticos de alta gama. Su orientación garantiza luz natural todo el día.
Además, dispone de vistas muy agradables, suelo de parquet, aire acondicion
";leganes-madrid
214.000;Piso en Calle de Madrid Casco Antiguo;82;3;Planta 3ª sin ascensor;/inmueble/107194757/;"
Inmueble sin posesión y sin acceso al interior. Las fotografías del interior y las características del activo pueden no ajustarse al estado actual.
NO COBRAMOS COMISIÓN DE INTERMEDIACIÓN AL COMPRADOR
INMUEBLE EN RENTABILIDAD
¡Tenemos en exclusiva un piso para ti!
Disponemos de un piso en edificio residencial que pu
";leganes-madrid
139.900;Piso en Casco Antiguo Leganés;77;1;Bajo exterior sin ascensor;/inmueble/108474883/;"
¡Descubre tu nuevo hogar en el corazón de Leganés! Este encantador piso de 77 m² construidos es perfecto para parejas o como primera vivienda. Con un ambiente cálido y acogedor, la cocina-comedor luminosa y moderna se convierte en el lugar ideal para disfrutar de momentos inolvidables. Los amplios ventanales permiten q
";leganes-madrid
170.000;Piso en Flores Leganés;61;3;Planta 4ª exterior sin ascensor;/inmueble/108310436/;"
Exclusivas Romero comercializa en Exclusiva vivienda en el Barrio de Las Flores.
Alquilada hasta septiembre - noviembre 2025.
El inmueble cuenta con una superficie de 60m2 y se distribuye de la siguiente manera: Hall de entrada, cocina amueblada, salón-comedor de con acceso a terraza, pasillo distribuidor, cuarto de
";leganes-madrid
230.000;Piso en Batallas Leganés;64;2;Planta 4ª exterior con ascensor;/inmueble/109080969/;"
Exclusivas Romero comercializa en Exclusiva vivienda en el barrio de Batallas, Leganés.
El inmueble cuenta con una superficie de 60m2 y se distribuye de la siguiente manera: Hall de entrada, cocina amueblada de gran tamaño, salón-comedor con acceso a terraza acristalada, pasillo distribuidor, cuarto de baño y dos dor
";leganes-madrid
204.000;Piso en Valdepelayo-Montepinos-Arroyo Culebro Leganés;55;1;Bajo exterior con ascensor;/inmueble/108386293/;"
Inmobiliaria Elite vende en exclusiva precioso apartamento amueblado, para entrar a vivir, todo exterior, de esquina, con piscina y zonas verdes
EL PRECIO QUE VES ES EL QUE PAGAS, SIN SORPRESAS!
FINANCIACIÓN GRATUITA!
Con una superficie construida de 55 m2, esta ubicado en la planta baja del edificio, y su orientació
";leganes-madrid
137.005;Piso en Plaza de los Ríos San Nicasio;65;2; sin ascensor;/inmueble/106309247/;"
NO COBRAMOS COMISIÓN DE INTERMEDIACIÓN AL COMPRADOR
INMUEBLE EN RENTABILIDAD
¡Tenemos en exclusiva un piso para ti!
Disponemos de un piso en edificio residencial que puedes adquirir en propiedad, muy bien distribuido y con distintas dependencias, ubicado en la localidad de Leganés, provincia de Madrid.
Este piso e
";leganes-madrid
177.000;Piso en Casco Antiguo Leganés;54;2;Bajo exterior sin ascensor;/inmueble/108964147/;"
Exclusivas Romero comercializa en Exclusiva vivienda en Leganés Centro.
El inmueble cuenta con una superficie de 50m2 y se distribuye de la siguiente manera: Hall de entrada, dos amplios dormitorios, un patio de 20m2 cuarto de baño y salón comedor con cocina americana.
Vivienda reformada, exterior, muy luminosa, ori
";leganes-madrid
139.900;Piso en Casco Antiguo Leganés;77;1;Bajo exterior sin ascensor;/inmueble/108474883/;"
¡Descubre tu nuevo hogar en el corazón de Leganés! Este encantador piso de 77 m² construidos es perfecto para parejas o como primera vivienda. Con un ambiente cálido y acogedor, la cocina-comedor luminosa y moderna se convierte en el lugar ideal para disfrutar de momentos inolvidables. Los amplios ventanales permiten q
";leganes-madrid
137.005;Piso en Plaza de los Ríos San Nicasio;65;2; sin ascensor;/inmueble/106309247/;"
NO COBRAMOS COMISIÓN DE INTERMEDIACIÓN AL COMPRADOR
INMUEBLE EN RENTABILIDAD
¡Tenemos en exclusiva un piso para ti!
Disponemos de un piso en edificio residencial que puedes adquirir en propiedad, muy bien distribuido y con distintas dependencias, ubicado en la localidad de Leganés, provincia de Madrid.
Este piso e
";leganes-madrid
240.000;Piso en Casco Antiguo Leganés;62;3;Planta 3ª exterior con ascensor;/inmueble/109310751/;"
¡TU NUEVO HOGAR EN EL CORAZÓN DE LEGANÉS TE ESTÁ ESPERANDO!
3 Dormitorios | Terraza | Ascensor | Cocina Americana | Céntrico
¡No dejes pasar esta increíble oportunidad!
Te presentamos este piso único en pleno centro de Leganés, con todo lo que necesitas para vivir con comodidad, estilo y cercanía a TODO.
Caracter
";leganes-madrid
226.000;Piso en Calle Capitan Muro Duran Leganés norte;91;4; exterior sin ascensor;/inmueble/106848544/;"
Inmueble alquilado y sin acceso al interior. Las fotografías del interior pueden no ajustarse al estado actual.
NO COBRAMOS COMISIÓN DE INTERMEDIACIÓN AL COMPRADOR
¡Esta es tu oportunidad!
Les ofrecemos en exclusiva este piso en edificio residencial que puedes adquirir en propiedad, muy bien distribuido y con distin
";leganes-madrid
299.990;Piso en Zarzaquemada Leganés;92;3;Planta 9ª exterior con ascensor;/inmueble/109299781/;"
GRUPO ZENON OFRECE: Vivienda luminosa, moderna y con vistas privilegiadas – Ideal para familias
Ubicado en una novena planta exterior con ascensor, este magnífico piso de 84 m² útiles (92 m² construidos) destaca por su estilo contemporáneo, su excelente distribución y una luminosidad inigualable durante todo el día,
";leganes-madrid
169.000;Piso en Descubridores-Escritores Leganés;72;3;Bajo exterior sin ascensor;/inmueble/108664218/;"
Agencia Inmobiliaria de Leganés zona Escritores Tecnocasa Consulting Inmobiliario Leganés Centro SL vende piso en zona DESCUBRIDORES - ESCRITORES de Leganés en PLANTA BAJA, entrada, salón, cocina, 3 dormitorios, 1 baño y despensa. Está situada en el casco antiguo de Leganés y muy cerca del Hospital Severo Ochoa, METROS
";leganes-madrid
165.000;Ático en Valdepelayo-Montepinos-Arroyo Culebro Leganés;97;1;Planta 2ª exterior con ascensor;/inmueble/108923913/;"
Loft Triplanta con Terraza y Espacios Comunes Premium – ¡Con Posibilidad de 2ª Habitación!
100% Inmobiliaria pone a la venta este espectacular loft de tres alturas, con un diseño moderno, altas calidades y una terraza privada desde la que disfrutar de vistas despejadas. Ideal tanto para uso profesional como residencial
";leganes-madrid
142.000;Piso en Calle de Santa Teresa de Jesús La Fortuna;55;2;Planta 2ª exterior sin ascensor;/inmueble/109241495/;"
INMUEBLE ILEGALMENTE OKUPADO
SITUADO EN LA CALLE SANTA TERESA DE JESUS 4, 2ºD, (LA FORTUNA) LEGANÉS, MADRID.
No se puede visitar, no se puede tasar ni se puede hipotecar. Se tiene que comprar pagando al contado y el comprador asume la tarea de la desocupación.
Amplio piso en Leganes, Madrid, perfecto para parejas. El
";leganes-madrid
196.000;Piso en La Fortuna Leganés;144;3;Semi-sótano exterior sin ascensor;/inmueble/108366894/;"
Agencia inmobiliaria de Leganés zona La Fortuna Tecnocasa Estudio Inmobiliario La Fortuna:
EN VENTA: Excelente Inmueble en el Barrio de La Fortuna. Exclusiva Tipología de inmueble.
Te presentamos este magnífico y amplio inmueble en venta en Tecnocasa La Fortuna CON MUCHAS POSIBILIDADES. 144 metros.
Cuenta con recib
";leganes-madrid
183.000;Piso en La Fortuna Leganés;56;1;Bajo exterior sin ascensor;/inmueble/108376146/;"
Agencia inmobiliaria de Leganés zona La Fortuna Tecnocasa Estudio Inmobiliario La Fortuna:
EN VENTA: Te presentamos este magnífico PISO PLANTA BAJA de OBRA NUEVA en el Barrio de La Fortuna.
IDEAL PARA PERSONAS MAYORES O CON MOVILIDAD REDUCIDA. Inmejorable ubicación, a 50 metros de la parada de autobús y a 3 minutos d
";leganes-madrid
210.000;Piso en Avenida de la Libertad La Fortuna;108;4; exterior sin ascensor;/inmueble/109241493/;"
INMUEBLE ILEGALMENTE OKUPADO
SITUADO EN LA AVENIDA LIBERTAD 9, BAJOS B, (LA FORTUNA( LEGANÉS, MADRID.
No se puede visitar, no se puede tasar ni se puede hipotecar. Se tiene que comprar pagando al contado y el comprador asume la tarea de la desocupación.
Amplio piso en Leganes, Madrid, perfecto para parejas. El inmueb
";leganes-madrid
223.000;Piso en La Fortuna Leganés;56;2;Bajo exterior sin ascensor;/inmueble/108375893/;"
Agencia inmobiliaria de Leganés zona La Fortuna Tecnocasa Estudio Inmobiliario La Fortuna:
EN VENTA: Te presentamos este exclusivo PISO PLANTA BAJA de OBRA NUEVA en el Barrio de La Fortuna.
IDEAL PARA PERSONAS MAYORES O CON MOVILIDAD REDUCIDA. Ubicación estratégica con fácil acceso a Madrid.
Descrito de entrada, amp
";leganes-madrid
179.000;Piso en CL San Melchor La Fortuna;56;3;Planta 1ª interior sin ascensor;/inmueble/108447936/;"
¡Descubre tu nuevo hogar en el corazón del barrio! Este encantador piso en venta, ubicado en la primera planta frente a la Avenida Libertad, ofrece un espacio semirreformado de 56 m² construidos y 50 m² útiles. Con tres amplios dormitorios, este inmueble es perfecto para familias o quienes buscan un espacio extra para
";leganes-madrid
200.000;Piso en Calle de los Monegros Zarzaquemada;60;2;Bajo exterior sin ascensor;/inmueble/109018248/;"
Agencia inmobiliaria de Leganés zona Zarzaquemada, Tecnocasa Area Inmoleganes 2024 Sl.
EN VENTA: Excelente vivienda reformada completamente exterior muy luminosa en Leganés (Zarzaquemada)
Piso en ZARZAQUEMADA, listo para entrar a vivir. planta baja de 66m2, Compuesto de 2 dormitorios, salón, cocina y baño.
Piso list
";leganes-madrid
175.000;Piso en La Fortuna Leganés;84;3;Planta 1ª exterior sin ascensor;/inmueble/108479390/;"
INMOBILIARIA RAÍZ Y HOGAR OFRECE:
Piso en venta – Ideal para inversores
84 m² construidos | 3 habitaciones | Terraza | Primera planta | Se vende con inquilinos
Se vende piso en primera planta con una superficie de 84 m² construidos, bien distribuidos y con excelente potencial de rentabilidad:
3 habitaciones amplias
";leganes-madrid
239.900;Piso en Zarzaquemada Leganés;61;3;Planta 3ª exterior con ascensor;/inmueble/108701846/;"
Te presentamos esta fantástica oportunidad de vivir en una de las mejores zonas de Leganés, a un paso de Madrid, en un entorno tranquilo, seguro y rodeado de todos los servicios.
Este luminoso piso de 3 dormitorios está diseñado para ofrecer comodidad, funcionalidad y calidad de vida, listo para entrar a vivir. Cuenta
";leganes-madrid
179.900;Piso en La Fortuna Leganés;54;3;Planta 2ª exterior sin ascensor;/inmueble/109026540/;"
INMOBILIARIA RAÍZ Y HOGAR OFRECE:
 Piso en venta en La Fortuna – Segunda planta exterior con terraza y vistas
Se vende luminoso piso exterior en la segunda planta de un edificio ubicado en el barrio de La Fortuna, una zona tranquila y bien comunicada.
Distribución:
3 dormitorios (todos con buena entrada de luz nat
";leganes-madrid
600.000;Chalet pareado en Valdepelayo-Montepinos-Arroyo Culebro Leganés;266;4;;/inmueble/108730277/;"
INMOBILIARIA RAÍZ Y HOGAR OFRECE:
 SE VENDE CHALET AMPLIO Y LISTO PARA ENTRAR A VIVIR 
¡Ubicación excelente y espacios para toda la familia!
Te presentamos este fantástico chalet que destaca por su amplitud, distribución funcional y estado impecable. Ideal para quienes buscan comodidad, espacio y un entorno agradab
";leganes-madrid
138.000;Piso en Calle Santo Ángel Santos;64;4;Bajo exterior sin ascensor;/inmueble/109078438/;"
PISO OCUPADO POR PERSONA SIN JUSTO TÍTULO (Antiguo Deudor Hipotecario)ESTE INMUEBLE DEBIDO A SU ESTADO OCUPACIONAL NO ADMITE VISITASIDEAL PARA INVERSORESLA LOCALIZACIÓN DEL INMUEBLE ES APROXIMADAVivienda de 61 m², según Catastro, y 3 m² de elementos comunes a la venta en el municipio de Leganés, Madrid. La vivienda est
";leganes-madrid
345.000;Piso en Vírgenes Leganés;86;4;Entreplanta exterior con ascensor;/inmueble/109237202/;"
¡OPORTUNIDAD!
Venta directa de propietario a particular.
¡ABSTENERSE AGENCIAS!
Vivienda en zona Vírgenes enfrente de RENFE, Metrosur, autobuses y a 5 minutos de la universidad.
Bajo exterior, planta entresuelo, 86m2 construidos, ascensor, trastero de 10 m2, portal adaptado para personas con movilidad reducida y pos
";leganes-madrid
450.000;Chalet adosado en Calle de Hoyo de Manzanares Valdepelayo-Montepinos-Arroyo Culebro;310;4;;/inmueble/108499835/;"
Oportunidad sólo para inversores. El activo se encuentra ocupado por persona sin justo título. Debido al estado ocupacional del activo, no se pueden realizar visitas al mismo. Chalet aislado de 310 m², de 4 dormitorios y 3 baños, en venta en Leganés, Madrid. Se trata de un chalet aislado de 310 m² desarrollados en 3 pl
";leganes-madrid
214.900;Dúplex en La Fortuna Leganés;65;2;Planta 2ª exterior con ascensor;/inmueble/109098042/;"
Agencia inmobiliaria de Leganés zona La Fortuna Tecnocasa Estudio Inmobiliario La Fortuna:
EN VENTA: Excelente Piso Duplex de 69 metros cuadrados en el Barrio de La Fortuna.
Te presentamos este magnífico PISO DUPLEX luminoso en venta en Tecnocasa La Fortuna. Este inmueble cuenta con entrada recibidor, amplio salón co
";leganes-madrid
240.000;Piso en Zarzaquemada Leganés;84;3;Planta 9ª exterior con ascensor;/inmueble/109329775/;"
Presentamos este atractivo piso ubicado en la tranquila y solicitada zona de Zarzaquemada, Leganés. Con una superficie construida de 84 metros cuadrados y un área útil de 78 m², esta propiedad se encuentra lista para entrar a vivir. Dispone de tres habitaciones sencillas que ofrecen confort y versatilidad según las nec
";leganes-madrid
299.000;Piso en La Fortuna Leganés;89;2;Planta 1ª exterior con ascensor;/inmueble/109291106/;"
Agencia inmobiliaria de Leganés zona La Fortuna Tecnocasa Estudio Inmobiliario La Fortuna:
EN VENTA: Excelente Piso en Finca seminueva en el Barrio de La Fortuna.
Te presentamos este magnífico PISO luminoso en venta en Tecnocasa La Fortuna. Este inmueble cuenta con entrada recibidor, amplio salón comedor, amplia coci
";leganes-madrid
419.900;Piso en Calle de Móstoles 24;114;3;Planta 1ª exterior con ascensor;/inmueble/107820845/;"
NO IMOBILIARIA
Vendo piso muy luminoso, cuidado y reformado con materiales de muy buena calidad. Cocina americana. DOS PLAZAS garaje y cargador para coche electrico instalado, Trastero.
Contacto directo con propietarios. NO IMOBILIARIA.
Ana. 6. 4. 2. 7. 4. 1. 6. 6. 0.
";leganes-madrid
345.000;Piso en Leganés norte Leganés;93;3;Planta 4ª exterior con ascensor;/inmueble/107261817/;"
Vivienda de 3 habitaciones, 2 baños, garaje y trastero en el barrio de Leganés Norte. Urbanización tranquila y familiar con zonas comunes, parque infantil y jardines.
Muy luminosa por su orientación y altura. Salón y habitaciones con vistas despejadas hacia zonas verdes.
La casa se encuentra en muy buen estado, para en
";leganes-madrid
179.000;Piso en Plaza Hernán Cortés Descubridores-Escritores;72;2;Bajo exterior sin ascensor;/inmueble/108134502/;"
La casa de tus sueños pone a su disposición este magnífico espacio para transformar de 72m2
Se compone de dos dormitorios uno doble y otro individual, salón comedor con cocina americana, baño completo con plato de ducha y tendedero.
Situado en una zona residencial rodeado de comercios y medios de transporte.
La casa de
";leganes-madrid
654.712;Piso en Plaza mayor 4;159;3;Planta 2ª exterior con ascensor;/inmueble/34652828/;"
A estrenar tras la reforma integral que tuvo un coste de más 200.000 euros, y más de 1 año de obra, que tuvimos que estar fuera de la vivienda. Pintura y material de obra retirado y raspado hasta ladrillo visto.
Vivienda situada en Plaza Mayor. Con Ascensor, trastero, patio, Multiples balcones y dos plazas de garaje,
";leganes-madrid
450.000;Chalet pareado en Calle de Hoyo de Manzanares Valdepelayo-Montepinos-Arroyo Culebro;310;4;;/inmueble/106985356/;"
Oportunidad sólo para inversores. El activo se encuentra ocupado por persona sin justo título. Debido al estado ocupacional del activo, no se pueden realizar visitas al mismo.Chalet aislado de 310 m², de 4 dormitorios y 3 baños, en venta en Leganés, Madrid.Se trata de un chalet aislado de 310 m² desarrollados en 3 plan
";leganes-madrid
169.000;Finca rústica en Camino del Monte de Esparteros 1;150;1;;/inmueble/99733530/;"
Se pone a la venta excepcional finca rustica emplazada en el parque polvoranca.
Cuenta con una superficie de 750m cuadrados y dos ambientes diferenciados y separados, uno habilitado para ocio y eventos, en el cual encontraremos una piscina, una zona techada, bonitas palmeras decorativas, y césped artificial en toda la
";leganes-madrid
139.000;Piso en Flores Leganés;53;2;Planta 1ª exterior sin ascensor;/inmueble/107762956/;"
Exclusivas Romero vende NUDA PROPIEDAD en Leganés, 2 habitaciones, baño, salón, cocina y terraza.
VENTA NUDA PROPIEDAD
El propietario, hombre de 93 años, continuará utilizando el inmueble en usufructo vitalicio.
Vivienda en excelente ubicación, ventanas aluminio, calefacción eléctrica, suelos de gres, baño completo
";leganes-madrid
205.000;Piso en Descubridores-Escritores Leganés;63;3;Planta 2ª exterior sin ascensor;/inmueble/109126804/;"
**Piso en Venta Ideal para Reformar**
Descubre este encantador piso de 63 metros cuadrados ubicado en la 2º planta. Con 3 dormitorios, este espacio ofrece la oportunidad perfecta para crear el hogar de tus sueños. La distribución es funcional y permite aprovechar al máximo cada rincón. El baño, aunque necesita una act
";leganes-madrid
188.000;Piso en Flores Leganés;60;2;Planta 4ª exterior con ascensor;/inmueble/108857679/;"
Piso alto y luminoso en edificio con ascensor. Vivienda de 57 metros cuadrados con hall, salón con terraza incorporada, dos dormitorios (principal también incorporada la terraza) y baño con plato de ducha.
El piso se reformó integralmente hace 15 años y tiene suelos de gres, ventanas de aluminio climalit oscilobatien
";leganes-madrid
169.900;Piso en El Carrascal Leganés;50;1;Planta 1ª con ascensor;/inmueble/108679128/;"
MAYA Consulting presenta este loft en una de las mejores zonas de Leganés un espacio único, funcional y con mucho estilo.
Características destacadas:
•50 m² construidos en planta diáfana, ideal para espacio de trabajo o vivienda moderna.
•Reforma integral a estrenar con materiales de máxima calidad.
•Diseño open conc
";leganes-madrid
216.000;Piso en priorato 80;70;3;Bajo interior con ascensor;/inmueble/108369024/;"
piso junto a Renfe de zarzaquemada, 3 dormitorios, salón comedor con vistas a zonas comunes, cocina amueblada con electrodomésticos, calefacción de gas natural individual, puertas de roble, suelos porcelanicos, ventanas de climalit, zonas verdes, tenis, piscinas a 15 minutos de la puerta del Sol.
mejor verlo!
No Agenci
";leganes-madrid
490.000;Piso en El Carrascal Leganés;121;3;Planta 6ª exterior con ascensor;/inmueble/109230740/;"
¡INMOAMP vende Piso con ascensor y terraza, muy luminoso, silencioso y en zona de Zarzaquemada!
Vivienda con 121 m2 construidos y totalmente reformada en 2025. Año de construcción en 1.975 con la ITE pasada y SIN COMISIÓN AL COMPRADOR.
Amplio salón con 26 m2 con ventanal grade que da a la gran terraza cerrada, 3 dorm
";leganes-madrid
210.000;Piso en Batallas Leganés;75;3;Planta 4ª exterior con ascensor;/inmueble/109290085/;"
¡Descubre tu nuevo hogar en este encantador piso de 75 m²! Situado en una cuarta planta con ascensor, este espacio cuenta con tres amplias habitaciones dobles, ideales para familias o para quienes buscan un lugar cómodo y acogedor. La cocina está completamente equipada, perfecta para preparar deliciosas comidas. La lum
";leganes-madrid
207.000;Piso en Las Dehesillas-Vereda de los Estudiantes Leganés;54;1;Planta 1ª exterior con ascensor;/inmueble/109201655/;"
Particular vende piso en el barrio de la Vereda de los Estudiantes.
Se trata de una vivienda en 1ª planta, con 48 m2 útiles (54 m2 construidos) y en buen estado de conservación.
El inmueble consta de un dormitorio con armario empotrado de tres cuerpos y terraza acristalada en patio interior, en la cual se ha instalad
";leganes-madrid
287.000;Piso en Calle del Ampurdán 5;103;3;Planta 6ª exterior con ascensor;/inmueble/109320808/;"
Amplia vivienda muy luminosa, con todos los servicios, colegios, guarderías, comercios. Próxima al metro, bus y Renfe. Cuenta con una distribución de tres dormitorios dos de ellos dobles, amplio salón comedor, estupenda cocina, WC completo con ducha, suelos porcelanicos, ventanas en climalit, aire acondicionado, calefa
";leganes-madrid
210.000;Estudio en La Fortuna Leganés;Bajo;108;;/inmueble/106090304/;"
Amplio piso en Leganes, Madrid, perfecto para parejas. El inmueble dispone de una superficie de 108 m² construidos distribuidos en salón-comedor, cocina. Está ubicado en el corazón de Leganes, en sus alrededores encontramos la escuela CEIP Ángel González, supermercados, bancos, farmacias, centros deportivos y la estaci
";leganes-madrid
193.000;Piso en Calle Mallorca 27;57;2;Bajo exterior con ascensor;/inmueble/108639734/;"
Piso de 2 habitaciones y 1 baño con ventana y plato de ducha, patio en usufructo. Reformado. Suelos de gres, ventanas de climalit, armarios empotrados, puertas lacadas en blanco, pintura en liso.
Contacto por whatsapp.
ABSTENERSE INMOBILIARIAS.
";leganes-madrid
244.500;Piso en Rioja 58;69;3;Planta 10ª exterior con ascensor;/inmueble/108918809/;"
Vivienda muy luminosa para entrar a vivir.
Con tres dormitorios, armarios empotrados, amplia cocina, ascensor, calefacción central, aire acondicionado en salón y habitación principal. Con trastero. Se entrega totalmente amueblada, incluidos electrodomésticos, algunos de ellos aún en garantía.
ABSTENERSE AGENCIAS.
Si
";leganes-madrid
473.999;Piso en Calle de Paraguay 9;102;3;Planta 3ª interior con ascensor;/inmueble/108302515/;"
Se vende piso de 3 habitaciones y 2 baños, con armarios empotrados, comedor de 30m2, cocina de 12m2 donde pueden comer hasta 6 personas, un baño con plato de ducha y otro con bañera, ventanas de cortizo con doble ventana.
Plaza de garaje para coche grande, zonas comunes con local, dos piscinas y gran pradera aparte de
";leganes-madrid
142.000;Piso en La Fortuna Leganés;52;2;Planta 2ª ;/inmueble/108772537/;"
Amplio piso en Leganes, Madrid, perfecto para parejas. El inmueble cuenta con una superficie de 51 m² construidos distribuidos en dos habitaciones, salón-comedor, cocina y un aseo. Localizado en el corazón de Leganes, en sus alrededores encontramos la escuela Secondary School IES La Fortuna, supermercados, bancos, bibl
";leganes-madrid
595.000;Chalet adosado en Derechos Humanos Leganés;240;4;;/inmueble/109075555/;"
Agencia Inmobiliaria de Leganés zona Escritores Tecnocasa Consulting Inmobiliario Leganés Centro SL vende chalet en el Centro de Leganés MAGNÍFICO CHALET UBICADO EN EL CENTRO DE LEGANÉS (ZONA TILOS). La vivienda cuenta con 4 dormitorios, 3 baños, salón, cocina y jardín. Este excepcional chalet está listo para entrar a
";leganes-madrid
239.900;Piso en Zarzaquemada Leganés;70;3;Planta 3ª exterior con ascensor;/inmueble/108897486/;"
**SE VENDE EXCELENTE PISO EN LEGANÉS**
Te presentamos esta fantástica oportunidad de vivir en una de las mejores zonas de Leganés, a un paso de Madrid, en un entorno tranquilo, seguro y rodeado de todos los servicios esenciales.
Este luminoso piso de 61 metros cuadrados cuenta con 3 acogedores dormitorios, diseñados
";leganes-madrid
260.000;Piso en Batalla Navas de Tolosa 16;65;3;Planta 2ª exterior con ascensor;/inmueble/106116808/;;leganes-madrid
169.000;Piso en Zarzaquemada Leganés;77;3;Planta 5ª ;/inmueble/108636960/;"
Oportunidad de inversión: inmueble alquilado. Renta actual: 200 €/mes. Fecha de fin de contrato: Vencido.
Piso en venta ubicado en CALLE LOS MONEGROS, LEGANÉS. Superficie de 77 m2. 3 habitaciones
Consulte con nuestro Agente Comercial la información adicional sobre el inmueble y las condiciones especiales de comprave
";leganes-madrid
239.000;Piso en Calle juan muñoz 14;98;3;Planta 3ª interior sin ascensor;/inmueble/30995567/;;leganes-madrid
299.900;Piso en Casco Antiguo Leganés;81;3;Planta 2ª interior con ascensor;/inmueble/109155206/;"
HOGARES LEGANÉS
VENDE EN EXCLUSIVA
OPORTUNIDAD!
Maravilloso piso reformado en la mejor zona de Leganés, se compone de;
Hall de entrada, tres dormitorios amplios, dos baños con plato de ducha y mampara; un GRAN SALÓN con salida a terraza abierta; cocina amplia muy luminosa con salida a tendedero.
Cuenta con suelo d
";leganes-madrid
