precio,localidad,tamanio,habitaciones,descripcion,link,descripcion_larga,distrito
215.000,Piso en Calle de la Encomienda de Palacios Fontarrón,81,4,Bajo sin ascensor,/inmueble/108562597/,"
Inmueble sin posesión y sin acceso al interior. Las fotografías del interior y las características del activo, pueden no ajustarse al estado actual.
NO COBRAMOS COMISIÓN DE INTERMEDIACIÓN AL COMPRADOR
No desaproveches esta excelente oportunidad de adquirir en propiedad este inmueble ubicado en la localidad de Madri
",moratalaz
144.000,Piso en Calle del Corregidor Señor de la Elipa Marroquina,50,1,Bajo exterior sin ascensor,/inmueble/106511455/,"
Piso OCUPADO
En Magna 4 Inmobiliaria somos especialistas en inmuebles de banco, si está buscando vivienda, local, suelo.. . nosotros te acompañamos en todo el proceso y no te cobramos comisión.
Activo adjudicado en subasta sin posesión
Actualmente, no es posible realizar visitas al interior del inmueble. Las fotogra
",moratalaz
139.000,Estudio en Calle del Corregidor José de Pasamonte Marroquina,Bajo,30,,/inmueble/109156051/,"
Estudio en Moratalaz, con 30 m² construidos, 1 dormitorios, 1 baños, nuevo, exterior, planta Baja, cocina con electrodomésticos, ascensor, amueblado, calefacción central. COMPROTUCASA VENDE!
Local habilitado como vivienda!
NO ES VIVIENDA!
FANTÁSTICO LOFT REFORMADO.
El inmueble, totalmente reformado, está distribuid
",moratalaz
315.000,Piso en Calle de Arroyo de Fontarrón Fontarrón,73,2,Planta 3ª exterior con ascensor,/inmueble/108363130/,"
Piso exterior reformado a medida. Consta de 2 dormitorios, 2 baños y cocina integrada.
En nuestras reformas se cambian todas las instalaciones y tabiquerías interiores, incidiendo en la eficiencia energética y el aprovechamiento del espacio.
La tabiquería interior se renueva utilizando doble tabiquería de pladur con
",moratalaz
240.000,Piso en Calle del Camino de los Vinateros Vinateros,57,2,Planta 4ª exterior con ascensor,/inmueble/108595851/,"
Vivienda alquilada. Inmueble para inversor.
La vivienda se vende con contrato en vigor hasta finales de 2027 pagando actualmente una renta de 800€.
Inquilinos solventes con pagos al dia demostrables.
Comunidad 40€/mes e ibi 230€/año.
",moratalaz
240.000,Piso en Calle del Camino de los Vinateros Vinateros,57,2,Planta 4ª exterior con ascensor,/inmueble/108595851/,"
Vivienda alquilada. Inmueble para inversor.
La vivienda se vende con contrato en vigor hasta finales de 2027 pagando actualmente una renta de 800€.
Inquilinos solventes con pagos al dia demostrables.
Comunidad 40€/mes e ibi 230€/año.
",moratalaz
173.094,Piso en Calle Pico de los Artilleros Fontarrón,60,3,Planta 1ª exterior sin ascensor,/inmueble/109214590/,"
Subasta concursal VIVIENDA PLANTA PRIMERA, en la calle Pico de los Astilleros número 200, Moratalaz, Madrid.
Superficie útil (según Nota simple): 58,76 m2
Precio de salida: 173.094 €
Puede ver toda la información y realizar ofertas en el link que aparece en el enlace adicional o en la página web actcon. es No olvide d
",moratalaz
215.000,Piso en Calle de Arroyo de Fontarrón Fontarrón,65,3,Planta 3ª exterior sin ascensor,/inmueble/107893870/,"
¡Oportunidad única en la Calle Arroyo de Fontarron piso de 65 m² autobuses. Situado en la 3º planta, cuenta con un amplio salón, cocina con comedor, tres dormitorios bien distribuidos y un baño completo.
la vivienda se encuentra para actualizar. Ventanas de climalit oscilobatiente. Caldera de gas natural y radiadores
",moratalaz
319.000,Piso en Calle de la Cañada Vinateros,60,2,Planta 2ª exterior con ascensor,/inmueble/108766773/,"
Piso reformado a medida en finca en buen estado con ascensor. Consta de 2 habitaciones, baño y cocina.
En nuestras reformas se cambian todas las instalaciones y tabiquerías interiores, incidiendo en la eficiencia energética y el aprovechamiento del espacio. La instalación eléctrica se compone de cuadro elevado y cambi
",moratalaz
325.000,Piso en Pisco de los Artilleros Vinateros,65,2,Planta 3ª exterior sin ascensor,/inmueble/88666192/,"
Oportunidad de inversión. Con rentabilidad del 5%. Este espectacular piso situado en TERCERA PLANTA SIN ASCENSOR, con posibilidad de su posterior instalación ya que se esta tratando en la junta de propietarios la aprobación para la instalación del mismo. Se distribuye en dos dormitorios con armarios empotrados, cocina
",moratalaz
175.000,Dúplex en Calle de Félix Rodríguez de la Fuente 23,155,4,Planta 4ª exterior con ascensor,/inmueble/106315155/,"
Se vende vivienda en El Ruedo
Ideal para inversores.
No se responderá a inmobiliarias.
",moratalaz
400.000,Piso en Calle de Félix Rodríguez de la Fuente 81,108,3,Planta 5ª exterior con ascensor,/inmueble/108583453/,"
Vendo piso en Madrid zona Moratalaz cerca de Al Campo con 2 cocheras (una de ellas sin la compra del suelo)
Todo exterior
Calefacción central individual.
",moratalaz
215.000,Piso en Calle del Corregidor José de Pasamonte 15,55,2,Bajo exterior con ascensor,/inmueble/83159062/,"
Ideal matrimonio con dos niños. Todo exterior, cómodo acceso.
Piso Bajo, muy bien situado y comunicado a 3 minutos andando de metro vinateros y autobuses.
Zona tranquila, parque al lado, pistas deportivas. Fácil aparcamiento.
Zonas verdes a pie de calle, colegio, instituto, cafeteria, farmacias, y comercio para ir anda
",moratalaz
375.000,Piso en Vinateros Madrid,93,3,Planta 2ª exterior con ascensor,/inmueble/108876433/,"
ABSTENERSE AGENCIAS. Se vende vivienda para reforma integral. Estado de origen. Tres dormitorios, Dos WC completos amplia cocina con terraza tendedero, armarios empotrados, terraza amplia en el salón, ascensor, portero físico, calentador de gas, muy bien comunicado por transporte público, autobuses, cercano a la boca d
",moratalaz
349.500,Piso en Calle de Arroyo de Fontarrón Fontarrón,106,4,Planta 3ª exterior con ascensor,/inmueble/108794091/,,moratalaz
370.000,Piso en Pavones Madrid,118,4,Planta 1ª exterior con ascensor,/inmueble/108300351/,"
Estupendo piso en el barrio de Pavones (Moratalaz), a 5 minutos andando del metro de Pavones y el intercambiador de autobuses.
Es una primera planta con ascensor.
El piso se encuentra para reformar.
Consta de hall, amplio salón, cocina con tendedero, 4 dormitorios, 2 baños.
Todas las estancias cuentan con ventana al e
",moratalaz
252.000,Piso en Fontarrón Madrid,69,3,Bajo exterior sin ascensor,/inmueble/106153391/,"
ABSTENERSE INMOBILIARIAS Y/O GESTORES DE INMOBILIARIAS.
Excelente piso en Moratalaz, para entrar a vivir. Es muy luminoso y exterior, ubicado frente a parques, supermercado, farmacia, y un parking. También hay zonas comerciales cerca y un centro de salud.
Tiene muchas posibilidades y consta de tres habitaciones, baño,
",moratalaz
558.000,Piso en Calle Entre Arroyos Media Legua,136,2, exterior con ascensor,/inmueble/108002548/,"
Se ofrece en venta la nuda propiedad de una vivienda de 134 m² situada en la calle Entrearroyos, en el distrito de Moratalaz, Madrid. La persona usufructuaria, una señora de 94 años, continuará residiendo en el inmueble de forma vitalicia.
El piso se encuentra en una planta alta de un edificio con ascensor, lo que le p
",moratalaz
475.000,Piso en Marroquina Madrid,90,3,Planta 2ª exterior con ascensor,/inmueble/108902807/,"
Luminoso piso con ascensor en zona tranquila de Moratalaz
En venta estupenda vivienda de aproximadamente 90 m² ubicada en una de las zonas más demandadas del distrito de Moratalaz. La propiedad se encuentra en una finca bien cuidada con ascensor, portero físico y acceso adaptado para personas con movilidad reducida.
",moratalaz
144.000,Piso en Marroquina Madrid,50,2,Bajo ,/inmueble/106469544/,"
Cómodo piso en Madrid, perfecto para parejas. El inmueble dispone de una superficie de 50 m² construidos distribuidos en dos habitaciones, salón-comedor, cocina y un aseo. Se encuentra en el centro de Madrid, muy cerca de C. de Alcalá en el barrio de Sol, a escasos minutos de Plaza Mayor, Mercado de San Miguel y Royal
",moratalaz
630.000,Piso en Marroquina Madrid,142,3,Planta 8ª exterior con ascensor,/inmueble/108251046/,"
**Exclusiva oportunidad en Moratalaz**
En el emblemático barrio de Moratalaz, específicamente en la zona de Marroquina, se encuentra este magnífico piso en altura que destaca por su excelente distribución. Con una superficie construida de 142 m², esta propiedad cuenta con tres amplios dormitorios, dos baños completos
",moratalaz
270.000,Piso en Av Moratalaz Vinateros,62,2,Bajo exterior sin ascensor,/inmueble/109117524/,"
Agencia inmobiliaria de MADRID – zona MORATALAZ – CAMINO DE LOS VINATEROS - PICO DE ARTILLEROS - CORREGIDOR DE JUAN DE BOBADILLA – TECNOCASA - VENDE - GRAN OPORTUNIDAD.
¡Oportunidad única en Moratalaz! Piso amplio de 62 m²+ 7 m² de trastero, ubicado en una zona verde y muy tranquila, te ofrece todo lo que necesitas pa
",moratalaz
349.000,Piso en Calle de la Hacienda de Pavones Fontarrón,75,2,Planta 2ª exterior con ascensor,/inmueble/109079791/,"
VOhome Propiedades Moratalaz pone a disposición esta vivienda REFORMADA A ESTRENAR CON ASCENSOR APROBADO EN JUNTA en la calle Hacienda de pavones.
91_032_73_67 Somos especialistas en cambios de vivienda, consúltanos como hacemos el proceso, totalmente diferente y ajustado a las necesidades de cada cliente!
Exclusiva
",moratalaz
650.000,Piso en Media Legua Madrid,118,3,Planta 7ª exterior con ascensor,/inmueble/108574284/,"
VOhome Quintana, vende fabuloso piso reformado de 118 m2 en séptima planta con ascensor, en barrio Moratalaz.
Piso exterior, con doble orientación, sureste y noroeste, ventilación cruzada, con vistas abiertas a parques, zonas ajardinadas y a la piscina de la propia urbanización.
Piso con un gran recibidor con armario
",moratalaz
420.000,Piso en Calle de la Marroquina Marroquina,90,3,Planta 5ª exterior con ascensor,/inmueble/108948511/,"
Descubre este luminoso y espacioso piso en la zona de Moratalaz, en el distrito de Moratalaz, en la zona de marroquina, en pleno centro de ocio de Moratalaz, construido en 1970. la vivienda cuenta con una superficie de 90 metros cuadrados, repartidos en 3 habitaciones y 2 baños, uno de ellos con plato de ducha. ventana
",moratalaz
365.000,Piso en Avenida de Moratalaz Vinateros,73,3,Planta 1ª exterior sin ascensor,/inmueble/108918029/,"
VOhome pone a disposición esta vivienda REFORMADA en la Avenida de Moratalaz
91_032_73_67 Somos especialistas en cambios de vivienda, consúltanos como hacemos el proceso, totalmente diferente y ajustado a las necesidades de cada cliente!
Luminoso piso reformado al detalle en primera planta con una superficie de 73m²,
",moratalaz
738.000,Ático en Calle Laguna Negra Horcajo,140,3,Planta 6ª exterior con ascensor,/inmueble/108981322/,"
Amabit vende exclusivo ático en Calle Laguna Negra.
Presentamos este magnífico ático de 140 m² situado en una urbanización privada con piscina comunitaria y zonas ajardinadas en un entorno residencial tranquilo y seguro. La vivienda destaca por su amplitud, luminosidad, excelentes calidades y dos terrazas muy amplias
",moratalaz
411.500,Piso en Avenida del Doctor García Tapia Media Legua,106,3, exterior con ascensor,/inmueble/107893888/,"
¡EXCLUSIVA DE VIVIENDA2!
DISEÑA TU HOGAR A MEDIDA EN UNA UBICACIÓN INMEJORABLE
VIVIENDA2 presenta en exclusiva esta magnífica vivienda exterior en planta baja ubicada en la reconocida Avenida del Doctor García Tapia, una arteria tranquila y bien comunicada en el consolidado barrio de Moratalaz.
Se trata de una propi
",moratalaz
419.000,Dúplex en Calle de Mario Cabré Marroquina,85,3,Bajo exterior con ascensor,/inmueble/109008324/,"
Blue Future Real Estate pone en venta en EXCLUSIVA este exclusivo producto que no dejará indiferente a nadie.
La primera imagen del anuncio refleja una RECREACIÓN VIRTUAL de cómo podría quedar la propiedad.
POSIBILIDADES DE FINANCIACIÓN A TRAVÉS DE NUESTRO DEPARTAMENTO FINANCIERO.
Vivienda TOTALMENTE REFORMADA y pa
",moratalaz
450.000,Piso en Calle de Luis de Hoyos Sainz Vinateros,96,3,Planta 7ª exterior con ascensor,/inmueble/109062479/,"
¡SOMOS PROPIETARIOS! Disfruta de todas las ventajas de comprar directamente a la propiedad.
Clikalia presenta este piso ubicado en el barrio de Vinateros, en Madrid.
La vivienda está ubicada en la 7 planta exterior con ascensor. Dispone de una superficie total de 96 m², distribuidos en salón y comedor, cocina abierta
",moratalaz
237.000,Piso en Calle de la Hacienda de Pavones Fontarrón,76,2,Planta 4ª exterior sin ascensor,/inmueble/108309551/,"
CONTACTAR CON LA EXTENSIÓN Nº 3
Piso en calle Hacienda de Pavones, en la zona de Fontarrón, perteneciente al
distrito de Moratalaz.
Edificio de 1970. Totalmente exterior. Si bien no dispone de ascensor, cuenta con el espacio adecuado que a nivel urbanístico es viable para su instalación.
ITE favorable y Certificado
",moratalaz
226.000,Estudio en Calle de la Marroquina Marroquina,Bajo,31,,/inmueble/109188881/,"
Piso de diseño a estrenar en calle Marroquina, a pocos metros del metro de Vinateros Reforma integral, alta rentabilidad e inmejorable entorno natural
Vivienda2 tiene el placer de presentar esta excelente oportunidad, ¿Buscas una vivienda lista para entrar a vivir o invertir, con calidades de lujo, diseño exclusivo y
",moratalaz
209.999,Piso en Avenida de Moratalaz Media Legua,51,2,Bajo interior con ascensor,/inmueble/109250347/,"
Si buscas una oportunidad de inversión en Madrid, este piso en Moratalaz es perfecto para ti. Actualmente alquilado desde mayo de 2022, ofrece rentabilidad desde el primer día.
- Ubicación: Situado en el consolidado barrio de Moratalaz, en una zona tranquila y bien comunicada, con comercios, colegios y transporte púb
",moratalaz
540.000,Piso en Calle de la Tacona Fontarrón,104,5,Planta 8ª exterior con ascensor,/inmueble/108912283/,"
Housfy vende piso en Moratalaz, Madrid.
Detalles del inmueble:
-8º planta exterior con ascensor en finca de 1975.
- Admirable piso de 104 m2 + 20 m2 de espectacular terraza con amplias posibilidades en Fontarrón. (Los metros cuadrados están verificados con la Dirección General de Catastro)
- Cálido salón-comedor que
",moratalaz
180.000,Estudio en Calle de la Marroquina Marroquina,Bajo,36,,/inmueble/108772332/,"
Extraordinario estudio PARA ENTRAR A VIVIR (o rentabilizar desde el primer día) con reforma reciente, en la calle Marroquina, junto a la Cuña Verde de Moratalaz, planta baja, exterior.
*Inmueble transformado a vivienda, a estrenar y con Licencia de Primera Ocupación aprobada por el Ayuntamiento de Madrid*
Estudio de
",moratalaz
270.000,Piso en Calle del Camino de los Vinateros Vinateros,75,3,Planta 4ª exterior sin ascensor,/inmueble/108969807/,"
Agencia inmobiliaria de MADRID – zona MORATALAZ – CAMINO DE LOS VINATEROS - PICO DE ARTILLEROS - CORREGIDOR DE JUAN DE BOBADILLA – TECNOCASA - VENDE - GRAN OPORTUNIDAD.
¡Oportunidad única en Moratalaz! Este encantador piso en buen estado a entrar a vivir de 75 m², ubicado en una zona mas verde y tranquila, te ofrece t
",moratalaz
575.000,Piso en Corregidor Alonso de Aguilar Media Legua,129,3,Planta 6ª exterior con ascensor,/inmueble/108841620/,"
SM HOMES Gestión Inmobiliaria presenta en exclusiva esta magnífica vivienda ubicada en el corazón de Moratalaz.
La propiedad cuenta con tres amplios y luminosos dormitorios, con posibilidad de habilitar un cuarto dormitorio. Dispone de dos baños completos, una espaciosa cocina con zona office y acceso a una terraza-la
",moratalaz
279.900,Piso en Calle de Arroyo de Fontarrón Fontarrón,80,4,Planta 1ª exterior sin ascensor,/inmueble/109103668/,"
Entreplanta de, 4 dormitorios, baño y aseo en arroyo fontarron, cocina con terraza tendedero, aire acondicionado, 78 metros utiles, muy buena zona residencial, frente a la a3, a 5 minutos andando de metro pavones y artilleros, muy cerca polideportivo, centro de salud y especialidades, intercambiado de autobuses, superm
",moratalaz
489.000,Piso en Calle de Valdebernardo Pavones,126,3,Planta 2ª exterior con ascensor,/inmueble/108731466/,"
Se vende estupendo piso muy luminoso y bien distribuido, ideal para familias. Cuenta con: 3 amplios dormitorios, 2 baños completos, Cocina independiente con tendedero, Salón-comedor con acceso a una gran terraza cerrada, perfecta como zona de estar o despacho. Trastero incluido, ideal para almacenaje, Plaza de garaje e
",moratalaz
249.000,Piso en Fontarrón Madrid,65,3,Planta 4ª exterior con ascensor,/inmueble/108404107/,"
Exclusivas Romero comercializa en Exclusiva vivienda en Moratalaz.
El inmueble cuenta con una superficie de 60m2 y se distribuye de la siguiente manera: Hall de entrada, cocina amueblada, salón-comedor de, pasillo distribuidor, cuarto de baño y tres dormitorios.
Vivienda exterior, con ascensor, fachada rehabilitada,
",moratalaz
212.600,Piso en Calle de Valdebernardo Pavones,91,3,Planta 10ª exterior con ascensor,/inmueble/107878636/,"
IDEAL PARA INVERSORES: VENTA DE NUDA PROPIEDAD.
NUDA PROPIEDAD. Grupo Retiro gestiona la venta de la nuda propiedad de una vivienda valorada en 374.062, 08€ euros a cambio de un Pago Único de Capital de 212.600 € (Posibilidad de pagos aplazados: 102.600€ a la firma y dos pagos anuales de 55.000€). Los usufructuarios,
",moratalaz
290.000,Piso en Calle de la Cañada Vinateros,60,2,Planta 1ª exterior con ascensor,/inmueble/108597552/,"
OPORTUNIDAD DE INVERSIÓN EN EXCELENTE ZONA – SE VENDE CON INQUILINO- JUNTO AL METRO ARTILLEROS
Se vende fantástico piso de 60 m², totalmente reformado con excelentes calidades. Originalmente de tres dormitorios, actualmente cuenta con dos dormitorios, lo que ha permitido ampliar y disfrutar de un salón espacioso y muy
",moratalaz
328.800,Piso en Calle Pico de los Artilleros Vinateros,80,3,Bajo exterior con ascensor,/inmueble/109181367/,"
Entreplanta en colonia privada familia y hogar, 80 mts. , 3 dormitorios, 1 baño completo con bañera, salon con terraza, cocina con terraza tendedero, excelente ubicacion, frente al metro artilleros linea 9, parada de de autobus, colonia privada con vigilancia 24 hs, parking exterior vigilado sin plaza fija, cuenta tamb
",moratalaz
210.000,Piso en Calle de la Encomienda de Palacios Pavones,60,3,Planta 4ª exterior sin ascensor,/inmueble/108735208/,"
*** PRECIO NO NEGOCIABLE /PRECIO NO NEGOCIABLE/PRECIO NO NEGOCIABLE/PRECIO NO NEGOCIABLE/PRECIO NO NEGOCIABLE/PRECIO NO NEGOCIABLE/PRECIO NO NEGOCIABLE ***
¡OPORTUNIDAD EN MORATALAZ! PISO DE 60 m² EXTERIOR, 3 DORMITORIOS Y TERRACITA
¿Buscas un piso con potencial en una ubicación excelente? ¡Aquí lo tienes!
Este inmue
",moratalaz
336.000,Piso en Calle de la Encomienda de Palacios Fontarrón,73,3,Planta 1ª interior con ascensor,/inmueble/108626163/,"
1º planta alta con ascensor, totalmente reformado, excelentes calidades, luminoso, 3 dormitorios, baño y aseo(ambos con ducha), cocina con terraza integrada, salon independiente, aire acondicionado, suelo de parquet, paredes lisas, doble cerramiento de aluminio con cristal climalit, en pasillos comunes vigilancia por c
",moratalaz
289.000,Piso en CL Pico Artilleros Vinateros,73,3,Planta 2ª exterior sin ascensor,/inmueble/108766425/,"
Piso con inquilinos en rentabilidad en Moratalaz, a 30 segundos del metro
Descripción:
Enamorarse de un hogar también es enamorarse de su luz…
Este piso tipo L4 en Moratalaz te ofrece eso y más.
Superficie y distribución:
– 75 m² construidos
– Exteriores, con orientación oeste: tardes doradas, cálidas y llenas de vid
",moratalaz
245.000,Piso en Calle de la Encomienda de Palacios 187,68,3,Planta 3ª exterior sin ascensor,/inmueble/109205430/,"
 Oportunidad en Moratalaz – Piso luminoso de 3 dormitorios con trastero
¿Buscas un hogar acogedor en una de las zonas más tranquilas y consolidadas de Madrid? Este piso en Moratalaz es justo lo que necesitas. Con tres amplios dormitorios, un baño completo, y trastero incluido, ofrece espacio y comodidad para toda la
",moratalaz
269.000,Piso en Calle Corregidor Juan Francisco de Luján 23,71,3,Planta 4ª exterior con ascensor,/inmueble/108934066/,"
Se vende vivienda con amplias posibilidades
* Totalmente exterior y muy luminosa lo que garantiza luz natural todo el día, tiene una superficie de 71 m2 construidos/68 m2 útiles, para actualizar con reforma. Esta situada en la 4* planta con el ascensor en ejecución y dispone de una muy buena distribución para aprovech
",moratalaz
260.000,Piso en Calle de la Encomienda de Palacios 115,83,3,Planta 2ª exterior sin ascensor,/inmueble/108776620/,"
Se vende piso muy luminoso en Moratalaz, en una zona muy tranquila, con mucho aparcameinto y zonas peatonales, ideal para descansar y disfrutar. El piso está recién pintado, cuenta con tres dormitorios, el más grande con un magnífico armario empotrado, en el pasillo podemos encontrar otro armario, baño completo con pla
",moratalaz
330.000,Piso en Avenida de Moratalaz 96,59,2,Planta 2ª exterior con ascensor,/inmueble/109069593/,"
Se presenta una vivienda reformado reciente, con 2 habitaciones amplias con camas de matrimonio cada una se han proyectado paredes exterior con espuma, ventanas motorizadas donde se pueden controlar como por pulsador táctil como por aplicación móvil, se incorpora en el pasillo trastero amplio, cuarto de baño reformado,
",moratalaz
630.000,Piso en Marroquina Madrid,142,3,Planta 8ª exterior con ascensor,/inmueble/108251046/,"
**Exclusiva oportunidad en Moratalaz**
En el emblemático barrio de Moratalaz, específicamente en la zona de Marroquina, se encuentra este magnífico piso en altura que destaca por su excelente distribución. Con una superficie construida de 142 m², esta propiedad cuenta con tres amplios dormitorios, dos baños completos
",moratalaz
270.000,Piso en Av Moratalaz Vinateros,62,2,Bajo exterior sin ascensor,/inmueble/109117524/,"
Agencia inmobiliaria de MADRID – zona MORATALAZ – CAMINO DE LOS VINATEROS - PICO DE ARTILLEROS - CORREGIDOR DE JUAN DE BOBADILLA – TECNOCASA - VENDE - GRAN OPORTUNIDAD.
¡Oportunidad única en Moratalaz! Piso amplio de 62 m²+ 7 m² de trastero, ubicado en una zona verde y muy tranquila, te ofrece todo lo que necesitas pa
",moratalaz
349.000,Piso en Calle de la Hacienda de Pavones Fontarrón,75,2,Planta 2ª exterior con ascensor,/inmueble/109079791/,"
VOhome Propiedades Moratalaz pone a disposición esta vivienda REFORMADA A ESTRENAR CON ASCENSOR APROBADO EN JUNTA en la calle Hacienda de pavones.
91_032_73_67 Somos especialistas en cambios de vivienda, consúltanos como hacemos el proceso, totalmente diferente y ajustado a las necesidades de cada cliente!
Exclusiva
",moratalaz
650.000,Piso en Media Legua Madrid,118,3,Planta 7ª exterior con ascensor,/inmueble/108574284/,"
VOhome Quintana, vende fabuloso piso reformado de 118 m2 en séptima planta con ascensor, en barrio Moratalaz.
Piso exterior, con doble orientación, sureste y noroeste, ventilación cruzada, con vistas abiertas a parques, zonas ajardinadas y a la piscina de la propia urbanización.
Piso con un gran recibidor con armario
",moratalaz
420.000,Piso en Calle de la Marroquina Marroquina,90,3,Planta 5ª exterior con ascensor,/inmueble/108948511/,"
Descubre este luminoso y espacioso piso en la zona de Moratalaz, en el distrito de Moratalaz, en la zona de marroquina, en pleno centro de ocio de Moratalaz, construido en 1970. la vivienda cuenta con una superficie de 90 metros cuadrados, repartidos en 3 habitaciones y 2 baños, uno de ellos con plato de ducha. ventana
",moratalaz
365.000,Piso en Avenida de Moratalaz Vinateros,73,3,Planta 1ª exterior sin ascensor,/inmueble/108918029/,"
VOhome pone a disposición esta vivienda REFORMADA en la Avenida de Moratalaz
91_032_73_67 Somos especialistas en cambios de vivienda, consúltanos como hacemos el proceso, totalmente diferente y ajustado a las necesidades de cada cliente!
Luminoso piso reformado al detalle en primera planta con una superficie de 73m²,
",moratalaz
738.000,Ático en Calle Laguna Negra Horcajo,140,3,Planta 6ª exterior con ascensor,/inmueble/108981322/,"
Amabit vende exclusivo ático en Calle Laguna Negra.
Presentamos este magnífico ático de 140 m² situado en una urbanización privada con piscina comunitaria y zonas ajardinadas en un entorno residencial tranquilo y seguro. La vivienda destaca por su amplitud, luminosidad, excelentes calidades y dos terrazas muy amplias
",moratalaz
411.500,Piso en Avenida del Doctor García Tapia Media Legua,106,3, exterior con ascensor,/inmueble/107893888/,"
¡EXCLUSIVA DE VIVIENDA2!
DISEÑA TU HOGAR A MEDIDA EN UNA UBICACIÓN INMEJORABLE
VIVIENDA2 presenta en exclusiva esta magnífica vivienda exterior en planta baja ubicada en la reconocida Avenida del Doctor García Tapia, una arteria tranquila y bien comunicada en el consolidado barrio de Moratalaz.
Se trata de una propi
",moratalaz
419.000,Dúplex en Calle de Mario Cabré Marroquina,85,3,Bajo exterior con ascensor,/inmueble/109008324/,"
Blue Future Real Estate pone en venta en EXCLUSIVA este exclusivo producto que no dejará indiferente a nadie.
La primera imagen del anuncio refleja una RECREACIÓN VIRTUAL de cómo podría quedar la propiedad.
POSIBILIDADES DE FINANCIACIÓN A TRAVÉS DE NUESTRO DEPARTAMENTO FINANCIERO.
Vivienda TOTALMENTE REFORMADA y pa
",moratalaz
450.000,Piso en Calle de Luis de Hoyos Sainz Vinateros,96,3,Planta 7ª exterior con ascensor,/inmueble/109062479/,"
¡SOMOS PROPIETARIOS! Disfruta de todas las ventajas de comprar directamente a la propiedad.
Clikalia presenta este piso ubicado en el barrio de Vinateros, en Madrid.
La vivienda está ubicada en la 7 planta exterior con ascensor. Dispone de una superficie total de 96 m², distribuidos en salón y comedor, cocina abierta
",moratalaz
