precio,localidad,tamanio,habitaciones,descripcion,link,descripcion_larga,distrito
1.340.000,Piso en Malasaña-Universidad Madrid,130,3,Planta 2ª exterior con ascensor,/inmueble/108375961/,"
PISO REFORMADO DE DOS DORMITORIOS EN MALASAÑA-UNIVERSIDAD
Estupenda vivienda de 130 m² distribuidos en dos habitaciones, ambas con cuartos de baño, una tercera habitación destinada a zona de laundry, cocina y gran salón comedor con dos balcones a la calle, completamente reformada, ubicada en el corazón del barrio de S
",centro
2.090.000,Piso en Huertas-Cortes Madrid,209,3,Planta 3ª exterior con ascensor,/inmueble/108779847/,"
Este piso se sitúa en una tercera planta de un edificio señorial en una de las zonas más emblemáticas de Madrid en el barrio de Las Letras. Esta espectacular vivienda de 209 m² combina amplitud y luz natural. La propiedad cuenta con una amplia entrada que da paso a un luminoso y generoso salón-comedor, ideal para disfr
",centro
1.900.000,Piso en Calle de Campoamor Chueca-Justicia,146,2,Planta 4ª exterior con ascensor,/inmueble/107112925/,"
Estate One ofrece piso ideal, recién reformado con buenas calidades, con todo detalle. Amueblado con una decoración actual y estilosa. Salón con dos balcones a la calle, y unas vistas a edificios muy bonitos del siglo XiX. Comedor comunicado con el salón pero espacio aparte. Cocina abierta pero en otra zona de la casa,
",centro
1.850.000,Piso en Huertas-Cortes Madrid,160,4,Planta 4ª exterior,/inmueble/109096545/,"
Lucas Fox presenta en pleno barrio de Las Letras, este espectacular dúplex reformado que combina amplitud, luz natural y una distribución pensada para el confort diario. Además, incluye aparcamiento. La vivienda se organiza en dos plantas y cuenta con un salón comedor espacioso y luminoso, ideal para compartir momentos
",centro
900.000,Piso en Calle de la Virgen de los Peligros Sol,82,1,Planta 2ª exterior con ascensor,/inmueble/108568337/,"
PISO A ESTRENAR AMUEBLADO EN SOL
A pocos pasos de la Puerta del Sol, Plaza de Cibeles y Calle Gran Vía, se encuentra este piso ubicado en Canalejas Residences.
Oportunidad única de adquirir una propiedad de lujo, ubicada en la segunda planta de un edificio histórico, rehabilitado y protegido por Patrimonio, en una de
",centro
985.000,Piso en Calle del Divino Pastor Malasaña-Universidad,129,2,Planta 1ª exterior con ascensor,/inmueble/107308505/,"
PISO A REFORMAR EN MALASAÑA
VIVIENDA CON ENCANTO EN EL CORAZON DE MALASAÑA.
Nada más llegar nos encontramos un gran hall de entrada que divide la zona de noche y la zona de día, a la derecha encontramos el salón comedor con dos grandes ventanales a la calle, chimenea de época y mucha luz, a la izquierda encontramos
",centro
950.000,Ático en Calle de Espoz y Mina Sol,100,2,Planta 4ª exterior sin ascensor,/inmueble/108855855/,"
Atico histórico con 2 terrazas en el Corazón de Madrid
Engel & Volkers tiene el placer de comercializar este exclusivo atico en el corazón de la Capital, a un minuto andando de la famosísima Puerta del Sol
Con una excelente ubicación,es una joya arquitectónica construida en 1900 que ofrece una experiencia de vida única
",centro
1.495.000,Piso en Palacio Madrid,198,3,Planta 1ª exterior con ascensor,/inmueble/104577165/,"
Señorial propiedad con tres balcones en el corazón de Austrias
Engel & Völkers presenta esta elegante propiedad en el corazón del Madrid de los Austrias. Ubicada en un edificio clásico de 1890 magníficamente conservado, ha sido reformada cuidadosamente para preservar algunos de sus elementos destacados, cómo los techos
",centro
286.000,Piso en Calle del Amparo Lavapiés-Embajadores,53,2,Planta 3ª exterior sin ascensor,/inmueble/108051186/,"
La Casa Agency Lavapiés te ofrece la oportunidad de adquirir en exclusiva un piso en la calle Amparo del multicultural barrio de Lavapiés – Embajadores en Madrid centro.
Este inmueble se encuentra ubicado en la tercera planta exterior de una finca construida en el año 1913, que se mantiene en buen estado de conservació
",centro
650.000,Piso en Calle del Ave María Lavapiés-Embajadores,118,3,Planta 1ª exterior con ascensor,/inmueble/107946948/,"
La Casa Agency Lavapiés gestiona en exclusiva un magnífico inmueble en venta en la calle Ave María del barrio de Lavapiés – Embajadores en Madrid centro.
Esta vivienda se ubica en la 1ª planta exterior con ascensor de una finca representativa construida en el año 1900 que su comunidad la mantiene en buen estado de con
",centro
1.290.000,Piso en Huertas-Cortes Madrid,91,1,Planta 3ª exterior con ascensor,/inmueble/108627385/,"
UNICA INMOBILIARIA presenta este fantástico dúplex situado en una de las zonas más prestigiosas y demandadas de Madrid: el emblemático Paseo del Prado, a escasos metros del Parque del Retiro, el Museo del Prado y el Jardín Botánico. Una propiedad que destaca no solo por su ubicación privilegiada, sino también por su di
",centro
584.000,Piso en Calle de los Señores de Luzón Palacio,68,1,Planta 2ª exterior con ascensor,/inmueble/107562445/,"
GILMAR presenta este espectacular piso en el barrio de Palacio, en Madrid. Con una ubicación inmejorable, este inmueble se encuentra al lado del Palacio Real y de la Plaza de Isabel II, lo que le proporciona un entorno histórico y cultural único.
Con una superficie de 68 m2, este piso cuenta con 1 dormitorio y 1 baño,
",centro
1.800.000,Ático en Chueca-Justicia Madrid,173,2,Planta 5ª exterior con ascensor,/inmueble/108375873/,"
ÚNICA Inmobiliaria pone a su disposición magnífico ático con dos terrazas en el prestigioso barrio madrileño de Justicia.
La vivienda se encuentra para actualizar y su actual distribución permite múltiples posibilidades ya que además se encuentra en la última planta.
Se ubica en una quinta y última planta y cuenta con
",centro
1.895.000,Piso en Chueca-Justicia Madrid,172,3,Planta 4ª exterior con ascensor,/inmueble/107873750/,"
ÚNICA Inmobiliaria presenta esta magnífica propiedad totalmente reformada en el prestigioso barrio de Justicia, cercano a la glorieta de Bilbao.
Se trata de una cuarta planta exterior con orientación oeste y dos balcones a la calle, con lo que el piso se inunda de luz natural durante todo el día y tiene sol directo en
",centro
415.000,Estudio en Sol Madrid,Planta,57,,/inmueble/98278992/,"
PISO EXTERIOR, LUMINOSO Y CON BALCÓN EN SOL
PISO LUMINOSO QUE DISPONE DE BALCÓN CON VISTAS EN SOL.
Piso con ascensor, luminoso, de 57 metros cuadrados según catastro, de los cuales 50m2 son de vivienda, con balcón, con vistas de la ciudad está en venta. La finca en la que se encuentra este singular apartamento está r
",centro
270.000,Piso en Calle de Embajadores Lavapiés-Embajadores,43,1,Planta 2ª interior sin ascensor,/inmueble/108254720/,"
Piso Reformado con Dormitorio Independiente y Plaza de Garaje en Calle Embajadores
Te presentamos una magnífica oportunidad en pleno corazón de Madrid: un acogedor y moderno piso interior con luz natural, ubicado en una segunda planta sin ascensor en la emblemática calle Embajadores, rodeado de vida urbana y con exce
",centro
850.000,Piso en Carrera de San Jerónimo 12,130,3,Planta 3ª exterior sin ascensor,/inmueble/108243018/,"
Vivienda reformada con vistas directas al Four Seasons y Galería Canalejas – Carrera de San Jerónimo.
Ubicado en el corazón histórico y más exclusivo de Madrid, este piso singular se encuentra en el numero 12 de la emblemática Carrera de San Jerónimo, con vistas directas al Hotel Four Seasons y a la Galería Canalejas.
",centro
1.980.000,Piso en Calle de Cervantes Huertas-Cortes,246,10,Planta 1ª exterior con ascensor,/inmueble/108922715/,"
¡Inversores atentos! Piso único en Huertas-Las Cortes con 247 m²
Una joya para reformar con infinitas posibilidades de rentabilidad
Características del Inmueble: Gran espacio, muchas estancias y un sinfín de posibilidades
En Sky Real Estate sabemos identificar el tipo de propiedades que solo aparecen una vez cada ci
",centro
1.700.000,Dúplex en Calle de las Infantas Chueca-Justicia,185,3,Planta 4ª exterior con ascensor,/inmueble/107771165/,"
Ubicado en el vibrante barrio de Chueca, en el corazón del distrito Centro de Madrid, este exclusivo ático es una joya para aquellos que buscan una vivienda de altura con el máximo confort y elegancia. Este inmueble, referencia 202755, se encuentra en un edificio señorial construido en 1900, que ha sido cuidadosamente
",centro
580.000,Piso en Calle de Trujillos Sol,73,2,Planta 4ª exterior sin ascensor,/inmueble/108776475/,"
PISO LUMINOSO CON VISTAS DESPEJADAS EN OPERA
Luz, vistas y encanto en el corazón de Madrid
Entre Callao y Ópera, en una de las zonas más deseadas de la ciudad, te espera esta vivienda exterior de 73 m², en una cuarta planta con excelente entrada de luz y vistas despejadas.
¿Qué la hace especial?
Salón independiente e
",centro
350.000,Piso en Calle del Mesón de Paredes Lavapiés-Embajadores,56,2,Planta 2ª exterior con ascensor,/inmueble/108308588/,"
PISO LUMINOSO Y UBICADO EN LA MEJOR ZONA DE LAVAPIES
En esquina con Miguel Servet, una de las calles más cotizadas y tranquilas del barrio, se encuentra esta joya: un piso reformado con mucho carácter, ubicado en una segunda planta con ascensor dentro de una corrala clásica recién rehabilitada.
Autenticidad con comod
",centro
1.290.000,Piso en Calle de San Bernardo 85,145,2,Planta 1ª exterior con ascensor,/inmueble/108787542/,"
BARNES Madrid presenta este piso único en Malasaña, una propiedad que combina el encanto de un edificio clásico con una reforma integral de diseño contemporáneo y materiales de primer nivel.
Ubicado en una primera planta con altura de segunda, este piso de 128 m² destaca por sus techos altos, la elegancia de sus acaba
",centro
1.542.000,Piso en Calle de la Ballesta Malasaña-Universidad,207,7,Planta 2ª exterior sin ascensor,/inmueble/108441987/,"
CONTACTAR CON LA EXTENSIÓN 2.
GRAN OPORTUNIDAD EN EL CENTRO DE MADRID! Piso exterior con licencia de hostal y plaza de garaje en la Calle Ballesta
Se vende espectacular vivienda exterior, muy luminosa en Calle Ballesta, en pleno centro de Madrid, a escasos metros de Gran Vía y rodeado de todos los servicios, comercios
",centro
3.100.000,Ático en Calle de Valverde Malasaña-Universidad,137,2,Planta 10ª exterior con ascensor,/inmueble/105642431/,"
Atico-Estrenar-2 terrazas Amueblado-Centro
BARNES presenta este ático para estrenar totalmente amueblado con dos terrazas y vista panorámica a la Gran Via una verdadera joya en términos de lujo, comodidad y ubicación privilegiada en Madrid que ofrece una experiencia de vida excepcional.
Totalmente amueblado y equipado
",centro
632.500,Piso en Calle de la Farmacia Chueca-Justicia,88,3,Planta 3ª exterior sin ascensor,/inmueble/108605986/,"
¡Exclusiva vivienda en la calle Farmacia, en pleno corazón de Justicia, Madrid!
Presentamos esta luminosa vivienda exterior, situada en la prestigiosa zona de Justicia, una de las áreas más codiciadas y vibrantes del centro de Madrid.
Con 88 m2 distribuidos de forma funcional, esta propiedad es una oportunidad únic
",centro
810.000,Ático en Lavapiés-Embajadores Madrid,121,2,Planta 4ª exterior con ascensor,/inmueble/105971690/,"
ÁTICO DE LUJO CON GIMNASIO, JARDÍN PRIVADO Y PARKING EN EL CORAZÓN DE MADRID
¡Imagina vivir en este impresionante ático de 121 m² en el corazón de Madrid! Una joya recién reformada con materiales de alta calidad y una decoración elegante y contemporánea, diseñada para quienes buscan lujo, confort y estilo en una de la
",centro
199.000,Piso en Calle de Lavapiés Lavapiés-Embajadores,30,1,Bajo interior sin ascensor,/inmueble/106477139/,"
La Casa Agency Lavapiés gestiona un piso en venta en la calle Lavapiés del multicultural barrio de Lavapiés – Embajadores en Madrid centro.
El inmueble se encuentra en un edificio del año 1900 que cuenta con la ITE favorable pasada el 15 de octubre del 2020.
Este piso se ubica a solo 6 minutos andando del Museo Nacio
",centro
135.000,Estudio en Calle del Salitre Lavapiés-Embajadores,Bajo,22,,/inmueble/107836658/,"
La Casa Agency Lavapiés gestiona un piso en venta en la calle Salitre del multicultural barrio de Lavapiés – Embajadores en Madrid centro.
El inmueble se encuentra en un edificio del año 1988 y muy cerca de la calle Santa Isabel, una de las arterias principales del barrio y, sin duda, de las más protagonistas. Se dist
",centro
290.000,Piso en Plaza de Lavapiés Lavapiés-Embajadores,67,2,Planta 4ª interior sin ascensor,/inmueble/107835591/,"
¡Descubre una magnifica oportunidad en el corazón de Madrid!
Este encantador piso se encuentra en el vibrante barrio de Lavapiés. Cuenta con una ubicación inmejorable, justo frente a la Plaza de Lavapiés, que te permite disfrutar de la auténtica esencia multicultural de la zona, una infinita variedad gastronómica y e
",centro
