precio,localidad,tamanio,habitaciones,descripcion,link,descripcion_larga,distrito
230.000,Piso en Calle de Cuart de Poblet 1,63,2,Planta 3ª exterior sin ascensor,/inmueble/108962653/,"
OPORTUNIDAD! Piso Reformado, Luminoso y con Excelente Ubicación – LAGUNA (Madrid)
***PARTICULAR *** Abstenerse Agencias.
Ponemos a la venta este precioso piso totalmente reformado, muy luminoso, con doble orientación y ubicado en una zona tranquila y rodeada de zonas verdes. A tan solo 400 metros de la estación de Cerc
",latina
260.000,Dúplex en Calle Poema Sinfónico 25,95,1,Bajo exterior con ascensor,/inmueble/109065432/,"
Se vende maravilloso LOFT DUPLEX BAJO, muy luminoso y con terraza privada y acceso a jardín comunitario.
Distribuido en dos alturas; en la planta alta se encuentra un dormitorio con amplio armario empotrado, baño completo con plato de ducha y mampara. En la planta baja tiene cocina americana con todos los electrodomé
",latina
299.000,Casa o chalet independiente en Calle de Koloman Wallisch 89,71,3,,/inmueble/109188851/,"
¡OPORTUNIDAD ÚNICA! CASA EN VENTA EN EL CORAZÓN DE MADRID
Ubicada en una zona inmejorable, rodeada de todos los servicios: centros de salud, colegios, institutos, una gran variedad de comercios y excelente comunicación con autobús, tren y metro. Calefacción independiente y gas natural.
La vivienda cuenta con una supe
",latina
